sentence,neg,neu,pos,compound
"The icons are so small, I struggle to read them even when they are there. Not user friendly.",0.258,0.742,0.0,-0.6377
I had to turn off my other sim because I kept getting cellular connection problems. Full bars of 5G yet internet wasn’t working.,0.119,0.881,0.0,-0.4019
Anyone else having this issue? Have you figured out a way to resolve it?,0.0,0.802,0.198,0.4515
What carrier are you on?,0.0,1.0,0.0,0.0
"Physical SIM is Verizon, eSIM is Visible.",0.0,1.0,0.0,0.0
"It can apparently be fixed by resetting the iPhone's network settings (per the article), so it doesn't completely brick your wireless. Regardless this is why you sanitize inputs.",0.0,1.0,0.0,0.0
I guess there is easier way to fix it trough icloud account on mac f.e. where you could delete such network from remembered networks list.,0.0,0.891,0.109,0.4215
What do you mean “sanitize inputs” if you don’t mind me asking?,0.0,1.0,0.0,0.0
I remember training engineering teams and clients on this way back in ~2001,0.0,1.0,0.0,0.0
"To people who don't want to click on clickbait shit: ""this hotspot"" is any access point named %p%s%s%s%s%n and you can fix it by resetting network settings.",0.162,0.838,0.0,-0.5889
what does that exploit?,0.318,0.682,0.0,-0.1027
"Oh, so it's the new alt F4",0.0,1.0,0.0,0.0
"Lol thank you, I been waiting for someone to give a name for the hot spot, the title is a bit broad haha. Had a feeling it was click bait. Worked well haha",0.0,0.607,0.393,0.9169
"""All my devices are named after format strings to f*** with poorly developed devices,"" Schou told BleepingComputer.A true intellectual XD",0.0,0.615,0.385,0.8918
Little Bobby Tables strikes again.,0.359,0.641,0.0,-0.3041
Lol that caption too. XKCD is awesome,0.0,0.42,0.58,0.7845
"I mean, strictly speaking, it was Little Bobby Tables’ parents that struck.",0.167,0.833,0.0,-0.25
We are worried this extremely specific thing could be abused by bad actors…. Here’s how to do it!,0.383,0.617,0.0,-0.8516
Yeah but this puts pressure on Apple to fix it. And they showed how to fix it in case anyone connects to one of these networks.,0.099,0.845,0.056,-0.296
Announcing it publicly puts pressure on Apple to fix the problem ASAP,0.329,0.671,0.0,-0.5994
I don’t think Tom Cruise can ... :P,0.0,0.657,0.343,0.4824
Also how to avoid it and resolve it if affected.,0.284,0.522,0.194,-0.0516
Name your hotspot %p%s%s%s%s%n and have iPhones connect to it,0.0,1.0,0.0,0.0
"It only works with this “xxxxxxxxxx” name, but can be misused if it’s called “free WiFi”. Fucking how?",0.0,1.0,0.0,0.0
It doesn’t only work with that name. That name was a proof of concept for the exploit. The name “Free WiFi %s%p%n” should also do the trick.,0.098,0.902,0.0,-0.1531
"This doesn’t help you, but out of curiosity - how come you don’t just use iCloud Keychain?",0.0,0.89,0.11,0.2144
"I personally don't use it because I don't have a macbook, I wanted something cross-platform and Bitwarden is perfect for that",0.0,0.812,0.188,0.5719
"I recommend against it as it locks you to Apple devices with no means to ever export your passwords. Bitwarden is free, open source, and cross platform, and if you ever decide you want to move, you can.https://bitwarden.com/help/article/import-faqs/#q-can-i-import-to-bitwarden-from-icloudmac-keychain",0.052,0.78,0.168,0.5994
I’d do it to be safe.,0.0,0.633,0.367,0.4404
If you need to ask then I think you already know the answer.,0.0,1.0,0.0,0.0
"Do it to be safe. Also I recommend using a reputable password manager — BitWarden (free/pretty cheap) or 1Password (pricier but has excellent UX) ought to work, they work pretty much everywhere.",0.0,0.657,0.343,0.9194
Use Bitwarden OP,0.0,1.0,0.0,0.0
"It depends on how they lock your notes. If it's not end-to-end encrypted and they store your data on their servers, that could end up being a security vulnerability if hackers manage to get into their databases and find the key to unencrypt any data their store. (I'm assuming this is the case, since you mentioned you wanted syncing but iCloud wasn't working for you.)You might as well delete the notes, delete the app, delete your account, and reset the passwords for those account if you want to be safe.Also, consider using a proper password manager.",0.015,0.925,0.06,0.5187
"There are reputable password managers out there, use one of those.I use Bitwarden because I use more than just Apple devices and should I decide to switch off of iOS, I can still get to my passwords. Unlike iCloud.",0.0,1.0,0.0,0.0
bout damn time.,0.574,0.426,0.0,-0.4019
I’m sure they wanted people to pay for premium to listen to videos in the background. PiP kinda kills that advantage but I’m glad they’re finally doing it. Maybe they realized no one wants premium finally,0.142,0.696,0.163,0.2298
Right? I think I watch 90% of my videos on YouTube.,0.0,1.0,0.0,0.0
"Agreed! But honestly, I’ll believe it when I see it. I’ll also not be shocked if they kill it before I get a chance to use it…because Google",0.175,0.536,0.289,0.3038
I’d appreciate it more if they stopped spamming me with the premium ads that require my input in order to move ahead.,0.195,0.705,0.1,-0.3744
Provided with YouTube premium...,0.0,1.0,0.0,0.0
About time. Took them long enough.,0.0,1.0,0.0,0.0
cries in 🇨🇦,0.574,0.426,0.0,-0.4019
I feel you. cries in 🇬🇧,0.403,0.597,0.0,-0.4019
Non-Americans being treated like the ginger stepchild yet again by google,0.0,0.8,0.2,0.3612
A Canadian in the r/apple thread said they updated YouTube a few days ago and got PiP,0.0,1.0,0.0,0.0
You can get pip in safari YouTube by using short cuts,0.18,0.82,0.0,-0.296
"I got it in Romania, works great but I have premium I’m not sure if it’s available for normal users.",0.116,0.762,0.121,0.0276
laughs in Vanced,0.0,0.385,0.615,0.4939
cries in the rest of the world,0.31,0.69,0.0,-0.4019
Why US only? I pay for Premium yet I’m not worthy of getting a feature I pay for.,0.303,0.697,0.0,-0.4949
welcome to:corporate bs,0.0,0.4,0.6,0.4588
Android user here (thinking of switching next year lol) same goes for all the non US Samsung users,0.0,1.0,0.0,0.0
6s plus?,0.0,1.0,0.0,0.0
Yep! On IOS 10.2.,0.0,0.546,0.454,0.3595
How’d you know it was a plus from the pic? Teach me your ways,0.0,1.0,0.0,0.0
I still use mine as my regular phone.,0.0,1.0,0.0,0.0
Ngl it looks a little strange (probably since I haven’t seen it in so long!),0.13,0.87,0.0,-0.202
Yah same for me it’s been awhile because I haven’t had a headphone jack since the release of the 7,0.0,1.0,0.0,0.0
"I still hate them for that, just like I hate them for removing all the useful ports from their MacBooks. I don’t use wired headphones, but I used the 3.5mm jack for testing audio equipment. I use the Lightning to 3.5mm adapter, but it’s so horribly thin that it could break any minute.",0.187,0.748,0.064,-0.8422
I use wired headphones. And that flimsy adapter breaks every few months... Another 10€ every time into Tim's pockets...,0.0,1.0,0.0,0.0
"Yeah, and I hate Netflix. Bring back VHS!",0.357,0.447,0.197,-0.4199
Soon this is gonna be on r/nostalgia,0.0,1.0,0.0,0.0
HAHA!,0.0,0.0,1.0,0.5093
"I see many posts of people trying to figure out what these boxes are in their rental properties, or in a home they just bought.  Square with a place to plug in a cable, but too small to fit a network cable.Homebuyers who have never seen a landline jack.What is this thing, round with three conductors, usually found on audio equipment or vintage cell phones?",0.0,0.947,0.053,0.5023
A very real scenario tbh,0.0,1.0,0.0,0.0
Can’t those be terminated in the larger plugs and get 100/10 through them via Ethernet? Easy new home upgrade.,0.0,0.861,0.139,0.4404
The same phone my grandpa carried in WWII,0.0,1.0,0.0,0.0
"Ah, the 6s. First iPhone, current smartphone, iOS 14.6. Battery life is starting to go meh, but I still dig this little thing.",0.052,0.948,0.0,-0.0387
Battery replacements through Apple are only $49,0.0,1.0,0.0,0.0
It has a block unknow callers and also most providers in the US have spam blocking apps.,0.381,0.619,0.0,-0.7906
I’m using my mini with one hand all day every day,0.0,0.758,0.242,0.4939
I’m using my 12 pro max with one hand all day every day lol,0.0,0.667,0.333,0.7184
How is your battery usage? My iPhone 12 has 20-40% - from the morning to the evening.,0.0,1.0,0.0,0.0
i bet you are :D,0.0,0.427,0.573,0.6166
"I’m actually considering going to a mini on the next iteration. I bought an 11 mid pandemic because my previous phone (iPhone SE 2016) was having battery issues, and it’s been great but I really miss one-handed usage.",0.062,0.871,0.067,0.0543
imagine reading this without context,0.0,1.0,0.0,0.0
"Same here, it’s great",0.0,0.423,0.577,0.6249
"Some have said “It’s not the girth of the earth, it’s the motion of the ocean.”.",0.0,1.0,0.0,0.0
I mean ya still can the se is getting iOS 15 lol,0.0,0.781,0.219,0.4215
"Stil have one. The screen to body ratio is crap. Could have been an 5“ in this form factor. Other than that, love the size.",0.087,0.772,0.141,0.3818
Isn’t the mini smaller than the SE. SE is pretty big for one hand use,0.0,0.67,0.33,0.7506
"Yea but no one really wants to buy it since it has the a9 processor and a terrible display lol.. the 12 mini is a step in the right direction for those that want a smaller phone with a modern design, let’s hope they make a 13 mini with a better screen design and or make an SE3 and make it a full screen display with a hole punch and a power button Touch ID like the rumors are! Supposed to be the first full screen iPhone ironically before the regular 13 and 13 pros lol. Would be a bad ass little phone though, if they do that I don’t see many people buying the iPhone 13 mini or 14 mini because if it comes with the A15 or A16 processor like the 13 or 14 then nobody would buy the 13 or 14 mini with a notch and Face ID when they can have a full screen hole punch design and have a Touch ID sensor for much cheaper too. If they do make an SE like that, I see them putting a previous gen processor in it to give people incentive to buy the newer flagships.",0.055,0.805,0.139,0.9493
Just get a 12 mini?,0.0,1.0,0.0,0.0
I can pretty much use my X with one hand in most cases,0.0,0.584,0.416,0.7506
"Same but still if the app does not support swipe back for some reason and I have to reach for the back button up top, I have to do some juggling with my palm to readjust the phone to reach the top",0.065,0.785,0.15,0.2054
I still use my phone with one hand all the time. I don’t get this post.drops phone and smacks it across room trying to catch italso drops it on face at night,0.0,0.901,0.099,0.4939
Yes. And i happy as a pig when we got the mini. Sad to hear the rumours saying 13 will be the last mini.,0.109,0.667,0.225,0.5106
"Yes because, outside of the US, Apple insists on sourcing data from The Weather Channel which isn’t the most accurate source of local weather data outside of the US. Also the extra features of the weather app isn’t available outside the US.",0.0,0.938,0.062,0.4019
Reddit has no concept of anything outside the US.,0.216,0.784,0.0,-0.296
What source does Apple use in the US?,0.0,1.0,0.0,0.0
Since the Xs Max I haven’t used a third party weather app.,0.0,0.769,0.231,0.4019
Same; I haven’t used a third party weather app in years,0.0,0.748,0.252,0.4019
Yes but only because I like dark sky so much. I still feel that the native weather app has some improvements to make and I’m surprised they haven’t been made with the acquisition of dark sky.,0.0,0.743,0.257,0.8555
"You’re in luck, OP is talking about the iOS 15 integrated app that’s basically dark sky by Apple.",0.0,0.85,0.15,0.4588
"Yep, I still enjoy the ridiculousness of CARROT",0.183,0.348,0.47,0.5106
"I’ve been sticking to mainly Apple apps for almost all apps except what Apple can’t offer me (e.g. grocery delivery, online shopping, etc.) the last few months. The simplicity I’ve grown adjusted to makes me cringe when using 3rd party apps that just complicates stuff. And I know Apple apps will continue to improve each year.",0.0,0.904,0.096,0.6808
Plus being in the ecosystem has its benefits like everything syncing across devices,0.0,0.683,0.317,0.6249
Yes. I want to see extended data like humidity for the next few days.,0.0,0.606,0.394,0.6705
This. Or even the next few hours.,0.0,1.0,0.0,0.0
"I still use another app for radar cause the stock iOS app just shows various shades of blue instead of green, yellow, and red for severity of precipitation. Not sure who thought that was a good idea but I hate it.",0.15,0.805,0.045,-0.6789
"Not on my phone with iOS 15. For my watch, I still use Weathergraph.",0.0,1.0,0.0,0.0
"The dev behind Weathergraph is going to have to find a different source for his weather information, since Apple no longer wants to share their Dark Sky data.",0.075,0.85,0.075,0.0
"Apple squandered their purchase of Dark Sky. Their new weather app still invades your privacy by sharing location data with The Weather Channel, and it still lacks tons of features available in Dark Sky’s app which will disappear next year.",0.044,0.89,0.066,0.2263
Improved? Do you have iOS 15?,0.0,0.591,0.409,0.5362
Yes.,0.0,0.0,1.0,0.4019
"Yes, because I also own an iPad and god fucking forbid we get a weather app there. I want to use a single weather app across my iPad, iPhone, and Apple Watch, if only so that I’d consistently get the same damn prediction on each device. Is that too much to ask for? Apple seems to think so.I love my devices. I keep buying them. But this aggravates the hell out of me because it’s such a stupidly fixable oversight.",0.205,0.716,0.079,-0.9378
Very valid point,0.0,1.0,0.0,0.0
"Have to say that my Homepods are as buggy as hell, generally",0.295,0.705,0.0,-0.6808
"Working! I believe it’s a problem with the NFC that OG homepods use. It’s probably difficult the first time because my iPhone had to scan for the nfc nearby. But once the nfc id was stored on my iPhone, it works rather seamlessly. It must be easier with the HomePod mini because of the U1 chip.",0.213,0.73,0.056,-0.8522
"Similar setup here with a HomePod mini on a network with two family connected iPhones in the house. About half the time it doesn’t even show up as an airplay device. When I do cast to the device, it will often play random music from my Music app while my phone continues to play what I was trying to stream from Spotify. The other day it was working, for once, playing Spotify, and I asked Siri to pause the music. Siri replied to tell me it couldn’t pause because it wasn’t playing music… I bought it because I have all apple products and people were raving about it, but at this point I just think they’re trash.",0.0,0.944,0.056,0.4939
"Do you have an wifi mesh system? I had annoying trouble when using AImesh with ASUS, but no problem with Eero",0.386,0.614,0.0,-0.8422
Nope. I’m using the airport time capsule WiFi network.,0.0,1.0,0.0,0.0
I believe if you subscribe to YouTube red you can play videos in the background on iPhone. I’ve also heard that YouTube is going to enable PiP soon… so we’ll see,0.0,0.924,0.076,0.34
"It should work with premium, and if not, you can use the YouTube desktop site on Safari/Chrome and you’ll get a Picture in Picture mode.",0.0,1.0,0.0,0.0
YouTube is going to enable PiP soonWhat is PiP?,0.0,1.0,0.0,0.0
There are shortcuts you can make to force YouTube on safari to have no ads and Pip to work for background play. Easy enough to set up,0.07,0.762,0.168,0.4767
Have heard something like that,0.0,0.615,0.385,0.3612
YouTube just announced they are rolling out the PIP to all ios user ...so is a matter of days..,0.0,0.939,0.061,0.0258
Maybe decades,0.0,1.0,0.0,0.0
*all US iOS users,0.0,1.0,0.0,0.0
"As far as I know, Picture in Picture is possible with the YouTube app only if you have YT Premium and it works (my friend uses it)",0.0,0.887,0.113,0.4939
"Yeah, I have premium. Does it only work on the newer devices then? Cause I signed into my premium acct. on an iPhone 8 today and when I exited there was no picture in picture",0.066,0.868,0.066,0.0
"So I recently switched from a Samsung to a 12 Pro Max and there are some things to say:PROS:UX/UI is just better, not only from a subjective view but the way most apps follow some standards and the integration of different elements (ex. gesture bar background is always transparent as opposed to Android, notification bar is always merged...).Apps and OS makes full use of device's hardware. You can notice the way your devices makes use of all your hardware, haptic engine, camera, LiDAR... (when i say camera for example you can test an iphone camera quality on the native camera app and other app like instagram, whatsapp... and do the same test on android and realize the conflict android project has to beat that is being the best OS for any hardware).Siri is way useful than Ok Google/Google Now, even though Ok Google is more ""intelligent"" and that when it comes to information it is way more accurate, Siri has more abilities system wide than its counterpart, for example I can tell her to send a whatsapp message, change settings options and more. Also I think its response time is faster¿Data privacy. So we all know Android is a Google product and even if it is open source it is GServiced and that means Google collects all your data, but that shouldn't be nothing new, we all know that Google makes money from data. As opposed to Apple that you can usually choose to share or not (or at least they claim to mantain your privacy).CONS:So all of these advantages come with some cost. We were used to use Android where you could do whatever you wanted: download premium apps for free, customizing your UI, adding more storage simply buying a 5€ SD... and Apple is just different, you have to pay for almost every app and installing a pirated version is difficult or not possible unless jailbroken or whatever... But overrall, I guess it is worth trying, sometimes the complicity, the ecosystem makes you not feel in need of those extras :/",0.03,0.87,0.1,0.9784
I never did too much customizing so I feel like I should be fine. We'll see.,0.0,0.706,0.294,0.5542
"Data privacy. So we all know Android is a Google product and even if it is open source it is GServiced and that means Google collects all your data, but that shouldn't be nothing new, we all know that Google makes money from data. As opposed to Apple that you can usually choose to share or not (or at least they claim to mantain your privacy).Apple collects your data too -- a higher variety in fact.And, Google doesn't sell your data. They own the ad platforms and delivery platforms themselves, that's a big difference. Ex: YouTube, Google Search, and Google Maps (to a small extent).And, Apple gets paid $10bn+/year by Google -- for what? To protect its users' privacy? LMAO. No. To sell their customers to Google BY DEFAULT.",0.02,0.884,0.095,0.9044
Is there any decent ad blockers on iPhone now,0.0,1.0,0.0,0.0
Complaining about not being able to install pirated apps?Not sure that’s a con tbh,0.119,0.728,0.152,0.128
"UX/UI is just better, not only from a subjective view but the way most apps follow some standards and the integration of different elements (ex. gesture bar background is always transparent as opposed to Android, notification bar is always merged...).IMO: This is only true for certain categories of apps.I use an iPad and S21U. The apps I use on both these devices are just fine in quality.It's if you go into the mid-tier paid apps ($10-15) range that you find that the availability and quality is different.",0.0,0.885,0.115,0.8591
"Siri is way useful than Ok Google/Google Now, even though Ok Google is more ""intelligent"" and that when it comes to information it is way more accurate, Siri has more abilities system wide than its counterpart, for example I can tell her to send a whatsapp message, change settings options and more. Also I think its response time is faster¿I like Siri more than Google Assistant right now. But, Google Assistant can send WhatsApp messages too.",0.0,0.888,0.112,0.6753
"Yeah iPadOS, there are also a few MacOS specific features in there, like running a shell script",0.0,0.734,0.266,0.5719
Maybe Apple adds it for pro line lol,0.0,0.714,0.286,0.4215
Pro Max at the very minimum!!,0.0,1.0,0.0,0.0
It’s almost as if they’re preparing to finally support split screen in the iPhone. Been a long time since ios 9,0.0,0.87,0.13,0.4019
This definitely won’t be coming to iOS 15. They would have announced it otherwise. This doesn’t seem to be a tiny feature that just gets added in a later beta.,0.0,0.909,0.091,0.4019
"For Mac I use Rectangle, works really good",0.0,0.653,0.347,0.4927
Did you read the question at all or just decide to read a couple of words and guess what the rest of the post said?,0.0,1.0,0.0,0.0
"Might be iOS 15 related, a shame you can’t get it to work",0.22,0.78,0.0,-0.4767
It is a new shortcut in the gallery in iOS 15.,0.0,1.0,0.0,0.0
Its available by search in iOS 14 too,0.0,1.0,0.0,0.0
https://apps.apple.com/us/app/split-screen-dual-window/id1525132136 this is the best we got for iPhone,0.0,0.656,0.344,0.6369
"I checked out these apps, but they are just browsers with multiple tabs opening on the screen. Can’t trust most of them.",0.0,0.818,0.182,0.6652
iPhone 6s Plus on the top,0.0,0.735,0.265,0.2023
"Agreed. Mine was great, except it was getting miserably slow. Had Apple not hid their functionality I would have swapped batteries and been happy with it for another year or two.I agree with slowing rather than crashing randomly. Absolutely. But it didn’t need to be hidden.",0.041,0.774,0.185,0.6483
"Seeing how the 6s is 6 years of support, 7 years if you count the last year of it getting full ios 15 updates till iOS 16 comes out, I have a feeling that the iPhone 8 and iPhone X and later will all have 7-9 years of support since their processors and ram are so far ahead of the A9, apple thinks the A9 is capable of 6 years at 1.9ghz and 2 gbs of ram if I’m not mistaken, imagine the A11 and above… those monster processors will last nearly a decade of support I predict!!! Insanity!! The 6s is the longest supported smartphone literally in history of smartphones! Apple is King.",0.031,0.817,0.151,0.9017
"iPhone 6S & 6S Plus, 7, and 8 all have 2GB of RAM. Only the 7 Plus and 8 Plus have more than that at 3GB; could cause some issues with future iOS versions.",0.0,1.0,0.0,0.0
"5s, 6s, and inevitably the 8 and X.",0.0,1.0,0.0,0.0
Now that the support length is 6 years I’d say they are #1 in longevity. It’s especially worth having a iPhone if you get Apple care so that when you inevitably get a battery replacement if you’re keeping the phone for 2+ years is very cheap. That will keep your phone feeling brand new.,0.0,0.83,0.17,0.8221
I’m still rockin the iPhone 6s Plus. Planning to upgrade to 12 in a few days though,0.0,1.0,0.0,0.0
Which color are you getting?,0.0,1.0,0.0,0.0
The support isn't everything. How would you rank them by their overall quality? How long they last without falling apart internally.,0.0,0.821,0.179,0.4843
The iPhone 5s was a beast for me ... last a solid 3 years with minimal issues,0.0,0.89,0.11,0.1531
"No I don’t think it’s possible. I would just use this app called HashPhotos. You can create hidden folders/albums of hidden photos. It’s a good app, I’ve used it for years.",0.068,0.776,0.155,0.4215
"I love almost everything about iPhone but one thing I miss dearly about Android is how you can organize pictures into folders in a normal way. It's still shocking to me that iPhone overcomplicates this simple process.On Android, any pictures taken can be moved from the default camera album into custom folders. On iPhone, you can move pictures to custom folders but they still stay in the default picture album. So if you have 200 pictures in folders and take 50 new ones, you now have to figure out which of the 250 pictures in the default album haven't been moved to your custom folders already. It's nonsense. Imagine you work in an office and you have 50 documents on your desk. You move them all into folders and you're nice and organized. If this was iPhone, you'd move the documents into folders but your desk would still have 50 documents on it.iPhone forces you to organize pictures how they want instead of how you want. A way I get around it is to have one group of pictures in the default album and another in the Hidden album. It's the only way to truly separate pictures.",0.043,0.877,0.08,0.775
Same one of my only problems with my iPhone. I don't want my mates to see my compromising photos when they use my phone. And I don't trust iCloud.,0.216,0.784,0.0,-0.6832
"Just delete them. If they are sensitive information, there are better way to store those. If they are picture of someone or yourself, delete them. Do it.",0.0,0.9,0.1,0.4404
You hide photos and then add them to an album like you do with normal photos.,0.093,0.769,0.137,0.2023
Except they don’t show up,0.0,1.0,0.0,0.0
"Why not create a couple notes in the notes app, copy the photos in to whichever note you want, and then lock the note with a password?  You could do different passwords for different notes and each note could be your folder.",0.044,0.924,0.032,-0.1316
"That’s actually not a bad idea, although I have over 10k hidden photos, whoops!",0.0,0.778,0.222,0.484
"You can press the menu button and filter the hidden folders to only show videos, Live Photo’s, screen shots, etc",0.0,1.0,0.0,0.0
