sentence,neg,neu,pos,compound
[],0.0,1.0,0.0,0.0
Been an android user from the beginning. I now am using an iPhone 8. Honestly the best choice I have made in years.  Quality of build is amazing and user experience is top notch.   Don’t know why i didn’t do this before.  And the best part?  Actual updates that fix things.   I don’t have to wait till the android maker decides to send out an update,0.0,0.77,0.23,0.9517
"Yea same, although many things I do miss from android though.",0.151,0.849,0.0,-0.1531
"Can vouch for this as someone who recently picked up an iPhone SE first gen after fiddling with an iPhone 6 and liking it; Android has it’s benefits but Google are making it more and more difficult to use it without their services that I decided to fully migrate.Buying an older MacBook Pro recently helped that transition as wellAn additional note that the first time I played with my SE after getting it, I was laughing at how this tiny phone was beating the 6 in performance hands down.",0.083,0.803,0.114,0.2418
"The worst decision Google ever made for Android was letting manufacturers develop their own OEMs. If it had been centralized and controlled by Google and they had kept it better updated, Android would have a much stronger userbase",0.094,0.78,0.126,0.1027
"You see, no one cares if the droid has more terahertz or processing power for less price of the actual experience of using the thing sucks",0.153,0.749,0.098,-0.1779
I switched in 2019 and I’ll never look back,0.0,1.0,0.0,0.0
"Top ""notch"" indeed!",0.0,0.489,0.511,0.2714
"Stock android (pixel) is incredible. It's much nicer than iOs, although apple has a few advantages with things like facetime, imessage etc.On the hardware side, nothing on android really comes close. And unfortunately, google has worst in class product support if you have issues.Really for me the perfect phone would be stock android running on an iphone with access to the few apple services that really shine. Of course it would never happen.",0.076,0.758,0.167,0.7783
"Honestly, I've been used an iPhone for the past 5 years, and I'm ready to go back.I have a Galaxy S8 I use with a second line, and if someone were to rob me to steal a phone from me, I'd give them the iPhone before I gave up the Galaxy.I've never disliked my iPhone more after anincident: I'm missing simple shit like picture-in-picture YouTube (I pay for that), app multitasking, default apps (I rely on Chrome -- stop sending everything to Safari) USB-C... and the most important thing -- no app restarting!The incident was: if I leave YouTube for a second just to check my messages in WhatsApp (I don't use Messages), I don't want to come back to YouTube and see the app reloading. Every time. Every single time.  If I want it to not reload, I have to leave the video playing and then scroll back. I've never experienced this with the Galaxy. And this happens with almost every app. Facebook, Reddit... I lose my place constantly and it's annoying. On the Galaxy I can wake up and be right where I was before I went to sleep -- even YouTube will reopen the video and I will be right where I was.What sealed the deal for me was... when my sister bought an S20 FE, took her watch off, and put it on the back of the S20 FE to charge. And it charged.Gimmicky, I know, but then I realized that Samsung / Android had surpassed my iPhone long ago, in ways I could never imagine. If my Galaxy S8 ... a phone as old as my iPhone 7+ was still fast and functional, then it was time to say goodbye.",0.077,0.887,0.037,-0.7217
"I'm in the opposite boat. Long time apple user, even worked at a store for 6 years. Back on May 1st, I had an issue with music sharing from my account to my wife's. I spent over 12 hours speaking with reps on chat and senior reps over the phone. They never resolved my issue or followed up with me even after trying to resolve the issue well into June. By the middle of May I gave up and got a free Adroid from T-mobile. The main thing I miss is the polish and consistency of the user interface and design language along with the stability of the operating system.What I don't miss is buying an expensive luxury device and being treated like I bought an entry level samsung. Now I have an entry level samsung and at least I can't get pissed off when they give me apple quality support since at least I'll actually be getting what I paid for.Edit: Forgot to add that I was certified in iOS repair.",0.027,0.861,0.112,0.9398
oneplus 7 pros to iPhone.Though spec-wise it feels like a downgrade I love every bit of (iphone+Airpods+AW) experiance.,0.0,0.66,0.34,0.7717
Bro if you wanna date a woman in the US your text better not be green,0.0,0.828,0.172,0.4404
Hope apple tracked down and paid a hefty sum to whoever created this stigma,0.0,0.692,0.308,0.5994
Ain’t that the truth lmao,0.0,0.326,0.674,0.7351
Why would you want to date an American woman who cares about such things tho,0.0,0.751,0.249,0.5106
Literally why I bought an iPhone 😂,0.0,1.0,0.0,0.0
That’s bullsh.,0.0,1.0,0.0,0.0
Why?,0.0,1.0,0.0,0.0
"The Mobile Verification Toolkit, or MVT, works on both iPhones and Android devices, but slightly differently. Amnesty said that more forensic traces were found on iPhones than Android devices, which makes it easier to detect on iPhones. MVT will let you take an entire iPhone backup (or a full system dump if you jailbreak your phone) and feed in for any indicators of compromise (IOCs) known to be used by NSO to deliver Pegasus, such as domain names used in NSO’s infrastructure that might be sent by text message or email. If you have an encrypted iPhone backup, you can also use MVT to decrypt your backup without having to make a whole new copy.https://github.com/mvt-project/mvt",0.029,0.94,0.031,0.0772
starts slamming face on iphone YO I DON’T THINK THIS FEATURE WORKS DOG!,0.0,1.0,0.0,0.0
i miss the 3D touch feature,0.286,0.714,0.0,-0.1531
nice,0.0,0.0,1.0,0.4215
It’s a tad bit chubby,0.0,1.0,0.0,0.0
It’s a love letter to all those people who are ok with  a thicker phone with larger battery,0.0,0.686,0.314,0.7506
I almost got it then cancelled. Not sure yet and if I’d need it every time.,0.234,0.766,0.0,-0.4519
More to love,0.0,0.309,0.691,0.6682
"Just received mine in Sydney Australia.Some quick observations:Battery was 0% on arrivalThe material does not feel the same as a white silicone case. It doesn’t have the same soft touch and is a harder type plasticVery compact and snaps on satisfyingly to both a leather case and the bare back of the iPhoneThe magnet attachment feels much stronger than the leather walletSame length and width as the leather wallet but obviously much thickerWeighs 115g, 11mm thickCharged phone from 83% to 91% in about 30 mins. Seem to have stopped after reaching more than 90% as indicated in the notification pop up when you first attach it.Some photos",0.022,0.909,0.069,0.4939
Thanks! Can you attach the wallet on the back of the battery? (Assuming no but your photo made it look like it lol),0.059,0.738,0.203,0.5983
Is this similar to the smart battery cases? Like it takes the charge away from the pack first?,0.0,0.742,0.258,0.6767
"Hey, I’m thinking about getting 1. Just a quick question. Was you on 14.7 at the time you got it. I don’t want to upgrade mine. You know. Jailbreak stuffs.",0.0,0.954,0.046,0.0772
"Also got mine today. NSW AustraliaOn the battery widget with the iOS 15 beta, the Battery Pack’s icon is a Lightning connector(?) even though I’m charging the Mini wirelesslyThe material does not feel the same as a white silicone case. It doesn’t have the same soft touch and is a harder type plasticIt feels a lot like the AirPods case, except the Battery Pack’s more of a matte finish than a shiny one",0.0,0.964,0.036,0.3612
What weather app is that? Been looking for a decent Australian weather app.,0.0,1.0,0.0,0.0
"It is chonkier than I expected, somehow.I really want to see it on a 12 mini before I make my decision.",0.0,0.914,0.086,0.1513
T H I C C,0.0,0.0,0.0,0.0
Comparison to the Anker one?,0.0,1.0,0.0,0.0
"Anyone know when the in store pickup date will be visible? I’m traveling in late July and don’t want to miss my delivery, so I’d rather just stop by an apple store",0.111,0.85,0.038,-0.3612
came here to ask this,0.0,1.0,0.0,0.0
Is it just me or does it look like a white iPod glued on the back of an iPhone?  The form factor is so similar,0.0,0.902,0.098,0.3612
“its rounded edges make it comfortable to hold.”Sadly not something I can say about my 12 Pro Max…,0.0,0.829,0.171,0.5106
Got to hold the newer phones for the first time last Wednesday and the way I hold my phone (pinky finger under the phone) it was a lot more uncomfortable to holdBut damn do the flat edges look nice,0.132,0.802,0.066,-0.4201
"“The revelation suggests governments using NSO Group software have been able to successfully hack iPhones to spy on user data using methods unknown to Apple, and that even keeping an iPhone up-to-date cannot stop a dedicated attacker who’s using expensive and secretive spy software.The nature of the attacks also suggests changing user behavior, such as avoiding clicking on unknown or phishing links in messages, may not protect iPhone users against NSO’s software. Past versions of Pegasus required the user to click a malicious link in a message, Amnesty International said.NSO Group is an Israeli firm that says it sells to vetted government agencies and law enforcement to prevent terrorism, car explosions and to break up sex and drug trafficking rings.”",0.111,0.82,0.07,-0.749
"""Even keeping an iPhone up-to-date cannot stop a dedicated attacker who's using expensive and secretive spy software.""To show why this is totally a normal thing:""Even buying and using the latest locks cannot stop a dedicated thief who's using expensive lockpicking tools or a battering ram.""""Even buying a chain for your wallet cannot stop a dedicated pickpocket who's a master of diversion.""""Even using fences and heavy duty panels on your electrical system cannot stop a dedicated idiot with wrenches and screwdrivers from electrocuting himself.""""Even teaching your elderly relatives about scams cannot stop a dedicated scammer with time and the ability to throw their voice from scamming your grandpa.""Anything can be hacked, broken into, damaged, breached, stolen, with ""dedicated attackers using expensive and secretive"" equipment and methodologies. They're dedicated, meaning they are willing to throw all of their time into finding an ""in"", and they're using tech that nobody knows about.Almost certainly every android device is also susceptible to ""dedicated attackers using expensive and secretive spy software"". Which sucks for me as an android user.",0.22,0.665,0.115,-0.9742
Yup.,0.0,1.0,0.0,0.0
"More coverage at:iPhone users alert: Amnesty drops a bombshell, claims Pegasus spyware can hack latest iOS too (msn.com)I'm a bot to find news from different sources. Report an issue or PM me.",0.0,0.929,0.071,0.296
"Thank you, Israel. Selling information on dissidents to get chopped to pieces in embassies.",0.0,0.839,0.161,0.3612
"So at what point are we all going to go back to simpler technologies in order to guarantee our privacy and security, similar to Battlestar Galactica? The attack surface on modern phones and other devices is truly enormous and growing with every passing day, security can only get worse and worse unless we change direction. Someone is going to eventually acknowledge this and enforce those kinds of measures. (No Mr. President, you can't use Whatsapp or Twitter) It'll need a critical mass to become viable for the general public is the problem...",0.11,0.781,0.109,-0.296
I will reinstall the house phone landline after you do,0.0,1.0,0.0,0.0
What simpler technologies are you referring to that are more secure?,0.0,0.788,0.212,0.4005
Linux: Allow me to introduce myself.,0.0,0.725,0.275,0.2263
What happened to apple products not being able to be hacked? So much for that. Just disable your calendar settings they hide em in there from streaming illegally 🤷🏻,0.14,0.86,0.0,-0.5267
Who's streaming what,0.0,1.0,0.0,0.0
"All technology can be hacked, lol. Whoever actually believed Apple couldn’t be hacked was naive. Hell, jailbreaking has existed as long as these products have been out",0.328,0.596,0.076,-0.8519
"Apple products not being able to be hacked, is from the time when there were so few Apple devices, that it wasn’t worth it for the hackers to target them. Now that they are everywhere they are targeted too.",0.065,0.889,0.046,-0.2023
"NSO software is outrageously expensive. Someone very rich and powerful would have to want to come after you to hack your iPhone. Ultimately, an independent judiciary is the only hope for an average citizen.",0.052,0.685,0.263,0.8384
“Throws iPhone on floor”,0.0,1.0,0.0,0.0
Me reading this on my new IPhone be like:,0.0,0.762,0.238,0.3612
Anyone ever get a text with a random sequence of numbers and letters? Not a linkCould that be what they’re talking about? I remember that bug going around where a certain sequence of numbers and letters on a text bricked the iPhone when opened,0.0,0.938,0.062,0.3527
Amnesty international is hardly a reputable source. Is there any confirmation from someone else.,0.0,1.0,0.0,0.0
Dunno,0.0,1.0,0.0,0.0
That is extremely worrying,0.473,0.527,0.0,-0.4005
Launch day iPhone 12 Pro at 94%,0.0,1.0,0.0,0.0
Same. 12 pro max.,0.0,1.0,0.0,0.0
"have had an 8+ for about three years, 81%",0.0,1.0,0.0,0.0
8+ same,0.0,1.0,0.0,0.0
IPhone X. Launch day. 82%,0.0,1.0,0.0,0.0
"Phone XR, bought June 2020 and still health at 100%, kinda amazing",0.0,0.758,0.242,0.5434
"XR since December 2018, 95%(Just under 6hrs of SoT in case it matters lol)",0.0,0.922,0.078,0.0258
Damn that’s good,0.409,0.152,0.439,0.0516
"iPhone 11, had since Dec 2019, battery health 91%but then it also says my battery needs service and they will replace my battery for free",0.0,0.879,0.121,0.5106
I have 92%. Same phone and same age.,0.0,1.0,0.0,0.0
Ahhh wtf I’ve got an 11 since October 2019 and I’m at 83% they won’t replace under Apple care until it’s less than 80% which I am sure is programmed not to happen until at least my Apple care expires,0.08,0.737,0.183,0.5994
"iPhone 12 mini on 91%. I’ve been keeping an eye on it recently and it was at 92% last week. Seems to be worse than my three year old iPhone X which was on 86% when I finally got rid of it. I got the 12 mini on 30th Nov and it’s already on 91%, a bit disappointed.",0.107,0.893,0.0,-0.7351
"Same, mine’s on 89!",0.0,1.0,0.0,0.0
Smaller device and more heat so it can’t dissipate as fast. Fast charging and MagSafe can also contribute to this drop. But sounds about right for the 80% or less after 2 years of use. Just an unfortunate side effect of the convenience of charging wirelessly and heat.,0.112,0.888,0.0,-0.6896
"11 Pro, 90%, purchased September 2019",0.0,1.0,0.0,0.0
iPhone 8 at 80% battery healthy. Had for 3 years,0.0,0.722,0.278,0.4019
That's quite bad,0.655,0.345,0.0,-0.5849
"12 pro, launch day, 95%",0.0,1.0,0.0,0.0
"iPhone 12 Pro, launch day, 89%",0.0,1.0,0.0,0.0
Bought my iPhone 12 Pro on Swappa. Battery health was at 99% when I got it. Now it’s at 96%.,0.0,1.0,0.0,0.0
12 mini launch day - 98%,0.0,1.0,0.0,0.0
Competition is good for all.,0.0,0.58,0.42,0.4404
I had to get an iPhone because they were all out of Samsung phones when I needed one.  The Picture in Picture functionality added since I last used one is much welcome and I really don’t mind this phone at all now.  Except the wifi sucks it goes out where my old phone wouldn’t,0.047,0.897,0.056,0.128
That stimulus money was no joke,0.262,0.476,0.262,0.0
Everyone knows that iPhones are just better than that Android trash.,0.0,0.775,0.225,0.4404
CORRECTION: Fandroid losers finally acknowledge the fundamental inferiority of their platform.,0.379,0.621,0.0,-0.6705
r/usernamechecksout,0.0,1.0,0.0,0.0
The ability to move icons without other icons moving.,0.0,0.777,0.223,0.3182
100% this!,0.0,1.0,0.0,0.0
the keyboard! I would enable the ability for a dedicated number row!,0.0,0.494,0.506,0.7339
"Heck, I'd be happy just to have it not switch back to letters every single time you hit the spacebar.",0.0,0.837,0.163,0.5719
"Add desktop functionality like the SamsungDex.Edit: I'm making a solution for this myself: https://youtu.be/k2kwCDxnHJEIf you're interested in trying it out, pm me",0.0,0.706,0.294,0.7579
"That looks interesting, is it on the App Store? I’m down to give it a try",0.0,0.838,0.162,0.4019
Really cool stuff.,0.0,0.435,0.565,0.3804
I am interested. Thanks.,0.0,0.152,0.848,0.6808
"Make them tougher, repairable, keyboard/mouse/monitor compatible, add a few buttons, replaceable battery, add a password protection layer to protect the data/phone function, add an answer machine function with code that would ring the phone.",0.0,0.875,0.125,0.5106
So you want Apple to sell the 2015 MacBook Pro again?Fair enough,0.0,0.875,0.125,0.1477
"USB-C!!! If I were the CEO, Lightning would be gone across the whole product line, it's just pure stubbornness and greed keeping Lightning around this long. Half their products are already using USB-C ffs.Other than that... allow free placement of icons on the home screen.",0.094,0.786,0.119,0.3129
Ironically the public at large would call Apple money hungry evil capitalists if they switched lightning out for USB-C‘You mean I can’t use my existing iPhone chargers to charge my new iPhone?’‘Apple just wants to sell me new cables’,0.106,0.894,0.0,-0.6597
Actually warranty water damage for phones advertised as being able to resist it.,0.211,0.789,0.0,-0.4939
Resistance ≠ Immunity,0.0,1.0,0.0,0.0
"Add USB-C, announcing new iPhone at the same time, not announcing some phones in the beginning of the year and some phones later in the year.",0.0,1.0,0.0,0.0
make everything cheaper lol,0.0,0.517,0.483,0.4215
"If you were CEO, you would lower profits?",0.198,0.541,0.261,0.1779
Make iPad run macOS when connected to magic keyboard. iPadOS when detached.,0.12,0.88,0.0,-0.128
How is that an iPhone change?,0.0,1.0,0.0,0.0
I’d add the option to remove of the homebar. Pretty sure people are smart enough now to realize you just swipe up. So stupid that the homebar shows up in screenshots,0.095,0.694,0.211,0.5434
USB-C.Something like DeX.Work better with Windows.Work with USB-C hubs.Bypass-charging toggle.$1k+ phones not having these feature is a rip-off.I change phones every 4 years and I think these features are a must!,0.0,0.815,0.185,0.69
What do you mean Bypass charging ?,0.0,1.0,0.0,0.0
"My S8 has this feature and I enjoy it. Whenever I put my phone face down and flip it back up, it takes a second for the AOD to turn on, meaning the AOD is off when the phone is face down or in a pocket",0.0,0.928,0.072,0.4939
Apple Watch aod does this.,0.0,1.0,0.0,0.0
"People have been saying this for years. I promise you it will only be on the Pro models with the LTPO displays.I get that apple likes waiting on features, but there have been well implemented AODs for years. There’s not much of an excuse here.",0.0,0.839,0.161,0.6858
Apple don’t think battery is good enough without ltpo. Just how they view things I guess,0.0,0.828,0.172,0.4404
The “excuse” is that no one really asked for an iPhone with an AOD. AODs don’t solve a problem any significant number of people have.,0.17,0.66,0.17,-0.25
"was gonna say, my old s7 edge before i switched had this. It's been years. Apple is slow af sometimes",0.0,1.0,0.0,0.0
"I miss having a notification light, that was one of my favorite little features on my android phones.",0.086,0.753,0.161,0.34
Yup. And iPhones still have the notch space to put one unlike androids,0.0,1.0,0.0,0.0
Wow. You just reminded me of something I didn’t know I missed. I love messing with the color and setting it to different colors for separate things,0.071,0.673,0.256,0.7783
Not exactly the same but there is a option on iPhones that will blink the flash when you get a notification while the device is locked. I think it’s under the accessibility settings.,0.0,1.0,0.0,0.0
"It's ridiculous that this is called an ""Apple Watch-like"" feature.Always On Display is a well established feature on most other flagship devices.",0.103,0.741,0.156,0.0717
"Journalists dumb it down as if phone enthusiasts don’t know what AoD is, no idea why",0.263,0.622,0.115,-0.4767
I rather have 3D Touch back.,0.0,1.0,0.0,0.0
not sure if this is helpful but my life was changed for the better when someone told me to long press the space bar to get control of the cursor like you were able to with 3DT,0.034,0.759,0.207,0.8186
Preach!,0.0,1.0,0.0,0.0
One of the reasons I am sticking to a XS Max. Last of the 3D Touch models. I love it especially when I want to edit something that I may have missed. Long pressing on the iPad doesn’t hit it same anymore. I am assuming it’s quite similar on newer phones.,0.044,0.84,0.116,0.5542
Yup. You and one other,0.0,1.0,0.0,0.0
"Apple really needs to work more and advertise less. I am providing a link to a post that talks about how the whole ""apple bug bounty programme"" actually workshttps://medium.com/macoclock/apple-security-bounty-a-personal-experience-fe9a57a81943",0.0,1.0,0.0,0.0
I have a 12 pro Max,0.0,1.0,0.0,0.0
Nice try fbi,0.0,0.417,0.583,0.4215
Oh cmon 😂,0.0,1.0,0.0,0.0
"""This is a question that gets asked to me pretty much every time we do forensics with somebody: ‘What can I do to stop this happening again?’” said Guarnieri. “The real honest answer is nothing.”Well... that's bad.",0.132,0.718,0.15,0.2023
Apple would need to include something like a delayed launcher state to catch it since rebooting makes it delete itself.,0.089,0.794,0.117,0.1531
I think the question many might wonder is if one can remove such intrusions by putting an iPhone into dfu mode and restoring it?I would guess simply putting it into restore mode would not help.,0.06,0.823,0.117,0.2828
Nuke it from orbit. It's the only way to be (remotely) sure.,0.0,0.827,0.173,0.3182
Boof it,0.0,1.0,0.0,0.0
Burn it with fire,0.444,0.556,0.0,-0.34
Throw it into volcano.,0.0,1.0,0.0,0.0
"there is always something you can do, like you can stop carrying a phone.",0.14,0.701,0.159,0.0772
"Ah, yes, the Vladimir Putin approach to problems like this. It does work.",0.151,0.559,0.291,0.3612
"“If you don’t use your phone, then there wouldn’t be any hacks. Slow the phone use dowwwn please!”",0.0,1.0,0.0,0.0
Then how would I play Diablo Immortal?,0.0,0.476,0.524,0.5267
The amount of knowledge required to create such a insidious piece of software is outstanding.,0.0,0.663,0.337,0.7269
"Kinda related i guess. I’m moving from a iPhone 7 to a 12 Mini, should i use Quick Start or should i do everything manually to avoid transfers of a possible virus?",0.084,0.916,0.0,-0.296
"Nobody has an answer to this. If nobody knows the vector of transmission, there's no way to even speculate and further, how ""safe"" you'd be and for how long.",0.073,0.927,0.0,-0.296
"Bump, great queation",0.0,0.328,0.672,0.6249
I already started looking at Linux phones this week after a movie I discussed while at dinner was the #1 recommendation on Amazon Prime the next time I turned it on.Our mobile phones are becoming nothing but spying devices.,0.0,0.962,0.038,0.09
Which phones are you considering?,0.0,1.0,0.0,0.0
Why not go for GrapheneOS or CalyxOS,0.0,1.0,0.0,0.0
Why didn’t you just ask for express replacement of your phone? It’s free with apple care +.,0.0,0.698,0.302,0.7579
I literally just found out that was an option…didn’t know that applied to iPhones.I guess that doesn’t apply in-store? Which seems like an oversight.,0.0,0.898,0.102,0.3612
"eSIM is a personal choice. Apple isn’t going to tailor their loaner inventory to someone’s specific use case.The Apple Store used to have SIMs they could give out, but I’m sure you could have just gone to a carrier store and gotten a SIM activated instead of abusing a return policy.This is beyond a minor inconvenience, and honestly something you could have just fixed on your own.",0.1,0.803,0.096,-0.0772
"Esim is personal choice mostly at this point, but there are e-sim only carriers now, so it’s not like it’s not keep happening. And it’s an advertised feature, so I thinks it’s only going to happen more. What if someone did use the dual esim feature on their primary and only device? It’s not Apple’s going to loan two iPhone 8’s.Does apple still give out SIMs? It was not offered to me as an option. I probably would have been okay with that. I know people have mentioned it years past, but it seems to be unclear now if that still happens.Hmm, I get that I’m ‘abusing’ a return policy, but I feel like there could be better options for a flagship device on applecare+.Actually…I knew this existed for watches, but didn’t know it applied to iPhones as well. if I mailed in the device and skipped the store, I could have done express replacement service, so I guess why can’t that be an option in store? It’s basically what I did on my own.Appreciate your opinion!",0.048,0.889,0.063,0.3941
Toss it in a drawer and pull it out every few years and wonder if you should keep it and then put it back in that drawer.,0.0,1.0,0.0,0.0
"Can confirm. My drawer has a 4, 4S, 5, 5s, a 5c, two SE, and a 7 in it. Don’t need any of them. The 7 gets some use as a WiFi only kids toy though.",0.0,1.0,0.0,0.0
should the battery be removed when storing these things long term??,0.0,1.0,0.0,0.0
In best case yes. And it should be charged to 50-70%,0.108,0.479,0.413,0.7269
