sentence,neg,neu,pos,compound
"It will be very interesting to see the Apple Maps update with the 3D render. If Apple wants to become the most popular mapping app, I believe they should arrange a crowd sourcing scheme, where user’s upload there images of streets and in return they receive discount/credits to use with Apple subscription services.",0.0,0.89,0.11,0.7258
Wow notification changes are underwhelming. JUST COPY WHAT GOOGLE DOES.,0.0,0.703,0.297,0.5859
"Agreed. Maybe they didn't show it, but if I still have to swipe twice to clear a notification I won't be happy",0.16,0.641,0.198,-0.0121
"Apps that provide account creation must now also provide account deletion. Even Reddit itself is going to fall foul of this, and any other 3rd party apps like Apollo. I don't think Reddit even offers account deletion in their API, so 3rd party apps in particular are in trouble here.",0.048,0.776,0.176,0.743
Apollo could simply just not allow account creation and comply. I don’t anyone stumbles across Apollo thinking it’s a first party service.,0.15,0.733,0.116,0.0567
"Apollo should be fine. It sends you to reddit.com to create an account, where you can also delete your account.Reddit app you can create an account in the app itself, but can't delete an account in the app so this would be an issue.",0.0,0.901,0.099,0.3612
Appeal to who? I’d assume Apple would have a separate team handling this instead of appealing to top execs.,0.0,0.904,0.096,0.2023
"You can appeal to Larry, Jason, and Walter. They’re in on Tuesdays and Fridays. Just drop them a call before you walk in. /s",0.087,0.913,0.0,-0.2732
I keep checking but it’s still not live,0.0,1.0,0.0,0.0
lmao same I’m opening up the music app every 30 minutes now,0.0,0.738,0.262,0.5994
Srry to bother u but how did you get the iPhone 12 Pro thing under ur name?,0.102,0.898,0.0,-0.1779
I'm going to wait till they do the HomePod update for HiRes.  Then I'll get their little trial to try it out.Call me crazy but when I heard the discontinue of the big Pod I went out and bought a second one to have a stereo pair.  It's been pretty good so I hope I get it gets that much better.,0.025,0.735,0.24,0.9484
"the homepod mini is trash compared to the big pod, I’ve been scooping up every one I can find on local Craigslist. Apples blowing it on the direction they’re choosing w/ homepods",0.0,1.0,0.0,0.0
Fwiw people weren’t buying them. Like ones that they recently sold are from the initial production run.,0.0,0.865,0.135,0.3612
Is this shite live yet? 12 hours later and I still don't see it.,0.0,1.0,0.0,0.0
It’s live for me I didn’t do anything special just went to settings for the music app and found new toggles,0.0,0.876,0.124,0.4019
What iOS version are you using ?,0.0,1.0,0.0,0.0
I have listened to a few songs in the spatial audio playlists and really don’t hear anything different. Am I missing something here? Using AirPods Pro by the way,0.081,0.919,0.0,-0.296
"I feel the same way so far. I got the trial today to see if it is worth it. Not sure if there is something I am missing. Also in the demo in the settings menu, I notice that the blue icon makes the waves move but in Music it doesn’t. Is that supposed to be a thing??",0.063,0.911,0.026,-0.2479
"It says I have it but the waves in the icon on my AirPods Pro aren’t moving and I can’t really hear a difference. Neither can my wife, do you think it’s really working yet or is it just underwhelming?",0.0,1.0,0.0,0.0
What is that?,0.0,1.0,0.0,0.0
"From Apple's Newsroom:""Apple is bringing Spatial Audio with support for Dolby Atmos to Apple Music. Dolby Atmos is a revolutionary, immersive audio experience that enables artists to mix music so the sound comes from all around and from above.""",0.0,0.932,0.068,0.4019
For those wondering (like I did) where to find Spacial Audio songs:open Music > Browse > select the Spacial Audio tile. Scroll down to see the different genres and select a playlist genre. Further down are some artists and albums too.,0.0,1.0,0.0,0.0
Holy shit. You really need iOS 15 to experience this with the unlocked head tracking. This is amazing.,0.154,0.684,0.162,0.0516
Should I use my iphone in landscape mode to get the most out of spatial audio ?,0.0,1.0,0.0,0.0
I don't see enabling spatial audio in my music settings,0.0,1.0,0.0,0.0
"If you’ve already downloaded music onto your phone, then enable lossless audio, do you have to re download the music?edit:  never mind, answered my own question. Clicked a song that I previously downloaded and it gave me a pop up saying to remove the download/redownload it. I’d love to take advantage but I’m not going through hundreds of albums just to do it 😐I really wish there was a way to detect/replace downloaded files to lossless in one shot instead of manually doing it. A lot of the frustration is the hassle, but I’m not gonna lie some of it is all my old music being on my “Recently Added” list",0.036,0.893,0.071,0.4478
Unless the magnet is really really strong I wouldn’t trust this on a bike,0.0,0.574,0.426,0.8144
Have you looked at OP’s video? The design has a grip that presses the phone against the MagSafe charger and stops the phone from moving laterally or rotating. IMO it should be sufficiently secure for streets.,0.043,0.892,0.065,0.2023
I’ll stick with my QuadLock,0.0,1.0,0.0,0.0
+1 Few of the gang I go mountain bike riding with got these and swear by these quadlocks! Best 60 dollar investment on a 1k+ phone.,0.043,0.794,0.162,0.6476
The quad lock is definitely more secure for off-road/mountain biking! I just wanted something that works with my existing charging ecosystem and could charge my phone on my commute home.,0.0,0.826,0.174,0.6893
Nice. And the power is coming from the S3 batterie…,0.0,0.763,0.237,0.4215
unfortunately no… I just hang a battery pack in the frame,0.231,0.769,0.0,-0.34
Omgggg take my money!!,0.0,1.0,0.0,0.0
How did you connect it to the battery?,0.0,1.0,0.0,0.0
I don’t,0.0,1.0,0.0,0.0
How much?,0.0,1.0,0.0,0.0
"so i’ll be happy to send a STL file customized to your case dimensions to you for $5, if you have access to a 3D printer.if you want me to make one for you… pm me and we can discuss possibilities :)",0.0,0.817,0.183,0.8055
How's the stability on bumpy mountain trail rides?,0.0,1.0,0.0,0.0
I wouldn’t try it. But then again you shouldn’t try bumpy trails with a vanmoof anyway.,0.0,1.0,0.0,0.0
Wow! Can you make it black? Is it safe in the rain?,0.0,0.576,0.424,0.8101
"Yes, it could be printed in black or spray painted black. It should be safe in the rain as long as the other end of the cable is not plugged in.",0.0,0.838,0.162,0.6808
Unless the magnet is really really strong I wouldn’t trust this on a bike,0.0,0.574,0.426,0.8144
Have you looked at OP’s video? The design has a grip that presses the phone against the MagSafe charger and stops the phone from moving laterally or rotating. IMO it should be sufficiently secure for streets.,0.043,0.892,0.065,0.2023
I’ll stick with my QuadLock,0.0,1.0,0.0,0.0
+1 Few of the gang I go mountain bike riding with got these and swear by these quadlocks! Best 60 dollar investment on a 1k+ phone.,0.043,0.794,0.162,0.6476
The quad lock is definitely more secure for off-road/mountain biking! I just wanted something that works with my existing charging ecosystem and could charge my phone on my commute home.,0.0,0.826,0.174,0.6893
Apple Music is an app I love to hate also. It’s mostly great on iOS these days (excited for the lossless/hifi) but the macOS app is just a garbage fire that somehow still works. I’d be mostly happy if they’d just unify by porting the iOS app to Mac without losing Smart Playlists and a few other library management features.They have been making a lot of quiet updates this year actually. Animated album covers and other small UI tweaks that are mostly good.I still miss Rdio though.,0.104,0.764,0.132,0.5774
Anyone that was lucky enough to have been subscribed to Rdio will always miss Rdio. I have several Rdio stickers that they sent me.,0.063,0.827,0.11,0.296
"They really just need to fix the web side of it. If you use it like it's iTunes - i.e. have all your music saved locally in playlists and mostly just use the web portion every once in a while to add new music, then it's perfectly good. But if you try to use it like it's Spotify then there's no comparison.It feels like this is a server-side issue since the web app (music.apple.com) is every bit as slow as the desktop app, so they wouldn't even necessarily need to wait on their release cycle.",0.027,0.829,0.143,0.872
Yeah the Mac app is literal garbage as well,0.0,0.619,0.381,0.5106
"I still miss Rdio though.It was the best. I went from Pandora > Rdio > Spotify > Apple. I tried Pandora again after they bought Rdio and supposedly incorporated some of their features, but it wasn't nearly as good.",0.119,0.811,0.07,-0.2045
"the macOS app is just a garbage fire that somehow still worksIf you like the macOS app, you'll really love Apple Music through iTunes on the PC!",0.073,0.704,0.223,0.7082
But do y’all remember MOG though?,0.0,1.0,0.0,0.0
"Rdio, now that’s a name I’ve not heard for a long time. A long time.",0.0,1.0,0.0,0.0
The new M1 MacBooks have Apple Music iOS version by default. The app is just called “Music” not iTunes. It’s pretty good,0.103,0.783,0.114,0.0701
They update it all the time on the server side though. Animated covers didn't come through an app/iOS update they were added without an update or in an earlier one but were enabled without any updates.,0.0,1.0,0.0,0.0
"And it looks like high res/Atmos will be server side too. Admittedly with the prep work done in an iOS update, but I think the point still stands.",0.0,0.937,0.063,0.1901
"You’re right, but similarly Spotify’s got sooo many important features missing that people have been asking for for YEARS and Spotify’s just ignoring them.But yeah, Apple treating AM like it’s part of the iOS rather than an app in of itself is very frustrating. I don’t know the inner workings of Apple, but AM needs an independent development team providing independent updates outside of major iOS releases.",0.135,0.761,0.105,-0.5251
This is where Android really nailed things for me when they uncoupled all their core apps from the OS and just had them as standalone apps that could be updated independently. That was a good move from Google and I have wished that apple would do the same for years. I feel it would let them iterate and improve many of their apps and services so much more.,0.0,0.916,0.084,0.7003
"Yep I was sick of Spotify not prioritizing basic functionality like lyrics and instead choosing to focus on weird podcast features, unnecessary constant UI overhauls, etc. They also straight up ignore community threads with thousands of votes on their idea platform; things like requests for M1 support just get ignored or sent a stupid ""keep voting!"" reply instead of them actually fixing the issue... or even acknowledging it's being worked on. Not to mention that when an actual good feature gets added, e.g. Apple Watch offline downloads, you get to enjoy A/B testing purgatory for literal months while they push out the feature server-side in batches. Apple Music isn't perfect, but it has basic functionality and sensible priorities.",0.097,0.803,0.1,0.101
"Spotify’s method of taking in ideas is so unbelievably fucking terrible. You need to make an account on Spotify’s official website, propose an idea; and if enough people vote for it they’ll consider it. I could wax on for hours talking about how utterly absurd it is.They’ll see people voicing concerns and such on social media, but ignore it because “tHeY dIdnT tElL uS On oUr wEbSiTe.” I’m surprised they’re succeeding this much since they willingly have their heads in the sand and asses in the wind.",0.061,0.869,0.07,0.2341
"Spotify’s got sooo many important features missing2FA for example. We’ve been clamouring about it for years, but they’ve been ignoring us as the retards they are.But in no way am I giving Apple Music a pass on this one. I don’t wanna wait for an OS update to patch my app, nor wait for a YEAR for a couple of feature launches. They should have spun it off as a semi independent company a long time ago. Heck, uncouple it and let them update their apps like the competition!Meanwhile the lack of features in AM gets annoying by the day. I can get past the meh recommendations and lack of something equivalent to Spotify connect. But when I realised AM doesn’t let me do collaborative playlists, I lost it. How the fuck haven’t they figured basic shit like this out yet? This is the bare minimum I expect from some of the best devs working for one of the richest corporations on the planet.Sorry for my rant. But I really want Apple Music to make it.",0.163,0.722,0.114,-0.8736
"Irish banks are a joke, it took until November 2020 for Bank of Ireland to roll out Apple Pay. For contrast RBS/NatWest/Ulster Bank first supported it 2015.",0.048,0.796,0.156,0.4767
it took permanent tsb until a few months ago lol,0.0,0.741,0.259,0.4215
AIB had it very early on. Issue is that it’s expensive as an bank to set up etc.,0.0,1.0,0.0,0.0
"Don't even get me started on BOI, fucking shite bank.",0.0,1.0,0.0,0.0
"As someone who prefers to pay in cash, I didn’t care that Bank of Ireland didn’t have Apple Pay setup until I lost my wallet. Having Apple Pay would have saved me a lot of hassle. But I had to do without a debit for a week and borrow money from my parents, all because BOI didn’t bother with Apple Pay until recently. Now that I have Revolut and Apple Pay, it’s not so much a hassle. I still prefer to pay with cash when spending below €100, but it’s nice to have the option of paying with my phone in case I lose my wallet again, or in case I accidentally leave my wallet at home and I don’t want to walk all the way back.",0.162,0.768,0.07,-0.7876
I just use TransferWise and Revolut. I don't need to go into a bank and since I decided to never take up a loan my life has been just swell,0.0,1.0,0.0,0.0
"In Mexico we just got it a few months ago, and even then just a select number of banks (not the biggest one yet). Most businesses don’t even accept contactless payment methods yet. :(",0.081,0.81,0.109,0.0
I’ll probably die before Apple Pay admits Visa cards in Mexico,0.342,0.516,0.142,-0.4767
"Not too bad, is it?",0.0,0.584,0.416,0.431
"In Germany too, top two banks (Commerzbank and Deutsche Bank) adopted Apple Pay in 2019-2020.",0.086,0.802,0.111,0.1027
My US Credit Union still won’t support it... 😑,0.0,0.531,0.469,0.6486
I still get mad that many taxis in the Uk still do not accept card or contactless payments. They take real cash. I don’t know if they’re just avoiding/evading taxes or hiding something,0.213,0.787,0.0,-0.7639
For some extra fun pay with Scottish Pound and watch the driver have a literal meltdown.,0.079,0.734,0.186,0.4404
"Same reason small businessess like your local barbers only accept cash. It costs them per transaction, which eventually adds up.",0.0,0.779,0.221,0.6249
It’s the taxes.In London it’s much better since TFL made a working card terminal a condition on taxi licences.,0.0,0.847,0.153,0.4404
"SPeaking of wallets and cash, will Apple Pay Cash ever be available outside of the US? Like come on, man.",0.064,0.822,0.114,0.2732
"If so, most likely in the EU (EUR countries only) because of unified SEPA which amounts to about 450mil people. Plus they could also leave the middleman Bank out of the game and just let people log in with their regular banks credentials, sending money over iMessage would then just send it straight from your account into the other persons bank account.",0.019,0.912,0.07,0.5106
"I like it that in Poland, even 95 year old babushka selling strawberries has a contactless terminal. I didn't use physical card or cash in over 5 years in Poland.",0.0,0.909,0.091,0.3612
Apple Pay? It’s been 6 years since hoping to be available in 🇹🇷…,0.099,0.704,0.197,0.34
Keep asking your bank when they plan to move into the modern world.,0.0,1.0,0.0,0.0
Turk Varmi??,0.0,1.0,0.0,0.0
Is that Pakistan?,0.0,1.0,0.0,0.0
"Don’t have to touch buttons in the store, yeah right. About half the stores where i use apple pay still require me to press debit or credit and approve how i want to receive my receipt. Sometimes other stuff as well.I complained to a couple places about how that defeats the touch-less concept and they were like “ Thats how our machine works”",0.139,0.767,0.094,-0.4588
"Man, I haven’t had to touch a terminal for ages now. Where I live it’s literally contactless even for a little shop down the street.",0.0,1.0,0.0,0.0
"I live in Australia, we don’t have any of that. Apple Pay is treated as a Visa / MasterCard purchase. Don’t have to touch the eftpos machine at all",0.053,0.947,0.0,-0.1027
"Agreed, the biggest problem is merchants (their corporate chain parents, that is) not updating their point of sale systems. Those card readers can be pretty old some places. I often will use Apple Pay and still have to hit enter on it or something. No one wants to actually pay to upgrade their systems.",0.128,0.783,0.088,-0.1027
"Tipping is a big problem as well (at least in the US where tipping is common).They need to add the ability to add a tip after you tap for payment. It gives you an opportunity to tip based on service after you get your food (rather than just blindly tipping).Starbucks already achieves this through their app, and it works really nicely.",0.04,0.805,0.155,0.7713
Not the case where I live. It’s contactless how it’s suppose to be. What country do you live in?,0.0,1.0,0.0,0.0
"I’ve got an iPhone X 256, zero problems with it. Battery health is 88%. It’s a refurbished one that I got two years ago. Finance has an 8+ that’s getting slow and battery dying quickly.Wanting to upgrade my phone 🤭and give my fiancé this X, since she doesn’t care about phones much.I’m trying to decide between a 12, 12 mini, or wait for the 13? Or maybe a 2020 SE…?",0.039,0.91,0.051,0.2168
"Looking for a clear case!I just purchased the iPhone 12 Purple. I love the color, and I really want to be able to display it. Any clear case I’ve tried in the past stains very quickly, though.I’m wondering if anyone has tried any clear 12 cases that do not stain/yellow extremely fast. Also preferably at least somewhat good as far as drop protection goes.Thanks!",0.029,0.741,0.23,0.9285
"How are you liking the iPhone 12 so far? I've been looking into changing back to Apple for a while now, I have a huawei p30 pro right now but I'm not really into the android thingy anymore, the purple iPhone had me completely sold 😭",0.0,0.957,0.043,0.2144
I have had decent luck with the spigen quartz hybrid case because the back is tempered glass. The borders yellow over time but it seems to be the slowest out of what I’ve tried.,0.0,0.941,0.059,0.25
I went from 12 pro 128 down to 12 mini 128. Best decision ever. Incredible piece of hardware.,0.0,0.792,0.208,0.6369
I was trying to decide about a 12 vs. a 12 mini.,0.0,1.0,0.0,0.0
Why did you downgrade ?,0.0,1.0,0.0,0.0
"My XS Max got wet, and stoped working.  The wefixit place says it’s irreparable due to corrosion.  I may have an insurance claim worth up to $575 to replace the phone, but either way I need a phone to use.  I was originally planning on trading the phone in and looking at the 13 or 12 (when the 12 drops in price in Sept) but seems like I have to make a decision now…So here it is… should I go with a used XS or X or something similar, where the price to buy and the trade in value come September will be similar (maybe within $100) and kick the decision on 12 or 13 till the fall as planned, or just bite the bullet and get the 12 now?For now I’m using an old iPhone 7 Plus with a terrible battery so I could also just replace the battery for the $100 and stick with this till Sept and make the call then with $575 (hopefully) from the claim towards the new 12/13….I need some help deciding.",0.024,0.912,0.064,0.7351
"I have an iPhone 8 and paid $80 to replace the battery until the 13 comes out. I personally would choose to do that (or get the 12) over buying a four-year-old phone (iPhone X), especially if you plan to keep the phone for at least two years.",0.0,1.0,0.0,0.0
"any good 2nd source iPhpne XS Displays? There are so many from in any price range, some recommendations?",0.0,0.839,0.161,0.504
"Hello highly educated people of Reddit!Should i wait for the Iphone 13 to release in September  for the prices of the others to drop or should i buy an Iphone 11 now?I currently have a Nokia 5.1(2018) and its been hell for the past months.Please point and excuse any grammar mistakes ,i am simply here for answers!Have a good day!",0.154,0.781,0.064,-0.783
I would consider an iPhone 12 now.,0.0,1.0,0.0,0.0
"Hey guys, due to some company policy changes i cant use my XR with my personal eSIM and i need to buy another iphone :)the timing is the worst, as the september is approaching and it seems like 13 will be revealed then.  I was wondering if there are any credible rumors if there will be any significant changes for the 13 that could possibly be worth waiting for ?If not i was debating whether to buy 12 (128gb) which is currently on sale for 849eur, or rather buy 12pro which is 1149eur. Is the 300eur (approx 370$) difference even worth paying for the 12pro?thanks!",0.038,0.882,0.08,0.3923
"I am think of taking advantage of Verizon’s $700 trade in deal to get new iPhones for me, my wife and son. I currently have the 8Plus , my wife has the 8 and my son has the 6S.I am thinking of the 12Pro Max for me and the 12 Pro for my wife.My main priorities for the phones are the storage size (64g just ain’t cutting it) the camera and performance.I like to game on my phone so I want the bigger screen of the max, my question is how much better is the max pro camera compared to just the pro? Or the regular 12?My wife now is always borrowing my phoen because it takes better pics than hers.She doesn’t want a huge phone so are the other 12s that much worse than the max?My wife kinda likes the 12 mini size but will she be disappointed with the camera?Thanks",0.048,0.861,0.091,0.4224
Hmm That´s a tricky one. Definately the mini is a great size for your wife´s 8 and I think the camera won´t dissapoint. I have a 6.5 android phone so a 12 or 12 pro won´t be much different to her but You could ask her or draw a diagram to show her the dimentions and then both of you can have an idea for the size.,0.021,0.937,0.042,0.3071
"I currently have an iPhone XS and havent really had problems with it. But I am jealous of magsafe haha....that's literally the only feature I want from the iPhone 12.I usually think its pretty dumb to get new phones in the summer time unless absolutely necessary, because the new models are always right around the corner. But Verizon is offering a killer deal right now ($700 off any iPhone 12 model with trade-in). Also all the rumors i have read of the iphone 12s/13 are kind of meh to me...but of course there might be some big surprise ...honestly based off the rumors I've read. The only feature that would be compelling enough for me is possible touch ID.Thoughts?",0.122,0.785,0.093,-0.7787
"Going to become a college freshman in the fall! With my current phone being an iPhone 6s, and hearing that iOS updates will probably be discontinued for it in the near future, I was wondering if I should buy the iPhone 11 or iPhone 12.I've been using my 6s for almost five years now and I plan to use this new phone for the next 5+ years as well (through college and, hopefully, a bit after that). Will the extra dollars be worth it for me to buy an iPhone 12 or will the iPhone 11 last me more than five years? I don't think I'm too interested in the potential iPhone 13...I'd love any advice!",0.0,0.881,0.119,0.9214
I’d say 12 if you can afford it. Will receive updates longer. Better camera I’m pretty sure and camera is way better,0.0,0.614,0.386,0.8834
How far out from launch do rumours get confirmed? I presume press get hands on for reviews ahead of the actual release?,0.0,1.0,0.0,0.0
They get confirmed on the stage. Everything up until then is rumours...sometimes very strong rumours but you won't get anything official before then.,0.0,0.905,0.095,0.3174
I just ordered a 12 pro max today. Switching from android. You can always sell the 12 & buy a 13 in a year... just me rationalizing a purchase...,0.0,1.0,0.0,0.0
"Well you can still cancel/return. New ones are just in a few months, as usual",0.0,0.861,0.139,0.2732
Anyone have that wallpaper that's in the headline pic of the article?,0.0,1.0,0.0,0.0
"The only thing I'm waiting for is TouchID. Apple would be insane to launch the 13 without that, during these pandemic times.I came across random comments saying Apple has ""resolved"" the unlock issue with Apple watch unlock. That statement is frankly absurd, entitled, and assumes that all iPhone users own the watch too.Whether TouchID is under the screen or below the power button, either solution is good and is a step forward.",0.035,0.87,0.095,0.5574
Why I still I have my iPhone8 plus.,0.0,1.0,0.0,0.0
Woah woah woah… Apple’s making a follow up to the iPhone???!That’s gonna be huge,0.0,0.793,0.207,0.4822
I don’t have such issues on my 12 mini. Though the screen turns slightly yellow on turning on true tone but I guess that’s a feature not a defect.,0.0,0.838,0.162,0.5352
