sentence,neg,neu,pos,compound
Samsung Galaxy v Apple iPhone - the smartphone duopoly,0.0,1.0,0.0,0.0
The iPhone at 10: How the smartphone became so smart,0.0,0.721,0.279,0.541
Apple iPhone beats BlackBerry as smartphone sales soar,0.0,1.0,0.0,0.0
iPhone 4S launch heats up smartphone rivalry,0.0,1.0,0.0,0.0
NHS Covid-19 and Zoom top Apple's iPhone 2020 app charts,0.0,0.833,0.167,0.2023
iPhone 5 smartphones stolen from London shop,0.39,0.61,0.0,-0.4939
"The iPhone turns ten, but here's what is coming next",0.0,1.0,0.0,0.0
Apple's profit beats estimates as iPhone sales surge,0.0,0.707,0.293,0.4404
iPhone 5 launches with larger screen and 4G access,0.0,1.0,0.0,0.0
iPhone 12: Apple makes jump to 5G,0.0,1.0,0.0,0.0
iPhone 5 faces tough competition in a crowded market,0.2,0.8,0.0,-0.128
Three criticised over £117 iPhone X monthly deal,0.318,0.682,0.0,-0.4215
How Apple's iPhone has changed through the years,0.0,1.0,0.0,0.0
Lower iPhone sales hit Laird profits,0.242,0.44,0.319,0.1779
Business Matters: Apple Unveils its Latest iPhone,0.0,0.845,0.155,0.0258
iPhone faces sales ban threat due to computer chip patent battle,0.545,0.455,0.0,-0.8625
BBM to be available on Android and iPhone this weekend,0.0,1.0,0.0,0.0
Apple iPhones among 'most stolen' handsets - Home Office,0.333,0.667,0.0,-0.5413
Up close with the new iPhone 5S and 5C,0.0,1.0,0.0,0.0
Apple's latest iPhones 'most likely' to get stolen,0.314,0.686,0.0,-0.4939
Cue some iPhone fever,0.0,1.0,0.0,0.0
Shares in Apple rise after iPhone deal with China Mobile,0.0,0.804,0.196,0.296
Palm Pre 'can challenge iPhone',0.0,0.755,0.245,0.0772
Apple silent amid iPhone 'chargegate' complaints,0.351,0.649,0.0,-0.4019
Is the iPhone evil?,0.595,0.405,0.0,-0.6597
China media: iPhone models,0.0,1.0,0.0,0.0
iPhone 11: Will Apple's latest phones capture India's growing market?,0.0,0.841,0.159,0.1779
Apple reveals two new iPhones,0.0,1.0,0.0,0.0
Viewpoint: Apple's iPhone launches no longer excite,0.214,0.485,0.301,0.2263
iPhone chip designer Arm Holdings says profits higher,0.0,0.707,0.293,0.4404
Apple iPhone 5 unveiled with taller screen and 4G,0.0,1.0,0.0,0.0
Blackberry boss 'outrage' at T-Mobile iPhone offer,0.0,1.0,0.0,0.0
Palm in red as iPhone grabs sales,0.0,1.0,0.0,0.0
Apple's iPhone 11 Pro and 'always-on' Watch unveiled,0.0,1.0,0.0,0.0
US to probe Blackberry and iPhone,0.0,1.0,0.0,0.0
China Mobile 'in talks' with Apple to offer iPhone,0.0,1.0,0.0,0.0
Bent iPhone claims put Apple under pressure to respond,0.216,0.784,0.0,-0.296
Apple offers free iPhone 4 cases,0.0,0.548,0.452,0.5106
Hands on with the Apple iPhone,0.0,1.0,0.0,0.0
Apple iPhone 5S and 5C handsets unveiled in California,0.0,1.0,0.0,0.0
