sentence,neg,neu,pos,compound
Maybe it also helps that the 12 Pro Max has more camera features than the smaller option?,0.0,0.86,0.14,0.3818
12 pro max is way too big for vast majority of people,0.0,1.0,0.0,0.0
Yep. There’s no se plus because people would buy that over the pro max,0.134,0.732,0.134,0.0
iPhone SE is excellent for the older people.,0.0,0.654,0.346,0.5719
Next super-cycle with iPhone 18 then.,0.0,1.0,0.0,0.0
And then the iPhone 24.,0.0,1.0,0.0,0.0
"I switched from my iphone 8 to the new 12.The Xr and 11 models were too chubby for me, this one is the perfect size.",0.0,0.856,0.144,0.5719
"Made the exact same upgrade. Feels great, right? I absolutely love this phone man. But yeah getting used to the size was a bit difficult during the early days, my pinky finger actually started to hurt haha. All good now though and I really appreciate the extra screen real estate. I probably wouldn’t have liked the iPhone XR or 11 though so I’m glad they shrunk it a bit.",0.087,0.601,0.312,0.9648
That means 1 in every ~75 people on earth own an iphone 12..Crazy,0.0,1.0,0.0,0.0
Or certain people have just bought more than one,0.0,0.792,0.208,0.2732
Holy shit that’s insane,0.759,0.241,0.0,-0.743
"Not surprised. Easily Apple’s strongest lineup in a long time and they made the phones look the best they have in a long, long time. Apple hit it out of the park with this one.",0.093,0.729,0.178,0.6595
I actually just upgraded from an iPhone 8 Plus to an iPhone 12 Pro Max today! It’s definitely an improvement in almost every way.,0.0,0.769,0.231,0.7177
I went from an SE1 to the 12 Pro in Feb. It was an astronomical difference.,0.0,1.0,0.0,0.0
"I went from an iPhone 8 Plus to the 11 shortly after release. I don’t regret it at all and my 11 is still working great. Although, next time I may go with a Pro or Pro Max version.",0.072,0.823,0.105,0.3182
"If I had to get a new iPhone right now, it would be the 12. The SE2, the XR and the 11 have low resolutions, and the 12 Mini is too small for me (though I’m glad it exists for those who want it). The size of the 12 is the sweet spot for me.",0.036,0.839,0.125,0.6369
Get the Apple one again tbh,0.0,1.0,0.0,0.0
For a “crappy adapter” that’s has the key feature you need to solve your problem.  Sounds like it is pretty un-crappy to me.,0.096,0.638,0.266,0.5859
I have never picked up a 5G signal.,0.0,1.0,0.0,0.0
Which country? I’m connected to 5G most of the time (USA).,0.0,1.0,0.0,0.0
Ask your cellular provider to enable it for your number or check under your account if you can do it yourself. Having a 5G mobile doesn’t automatically means you get 5G signals.,0.0,0.958,0.042,0.0772
Same. Feels vaguely familiar to when we first got USB-C in a non USB-C world.,0.0,1.0,0.0,0.0
I’m just outside Atlanta and have 5G pretty much everywhere and I’m some spots I get 5GUW with Verizon. Just depends on where you live and if your carrier/plan supports it,0.0,0.831,0.169,0.6908
5G wasn't exactly the game changer they touted it to be.They lied to us.,0.241,0.759,0.0,-0.4215
5G has only just begun,0.0,1.0,0.0,0.0
In the San Francisco Bay Area I get 5G most of the time. Right now I’m in Chicago for work and I am seeing 5G+ which is mmWave I believe,0.0,1.0,0.0,0.0
Off topic but the camera module on the base pro looks huge. Imo it’s really ugly.,0.224,0.641,0.135,-0.4478
None of the phones in that image are actual iPhones,0.0,1.0,0.0,0.0
I delete them from my phone and then no one can see them 😎,0.167,0.833,0.0,-0.296
I just paste all my photos into a note and lock the note with a password. You can also unlock it with Face ID/Touch ID or you can set it so it can only take your typed in password. Pretty neat.,0.0,0.853,0.147,0.7351
you can literally hide photos/videos in your photos app. There’s a hidden album. ????,0.181,0.819,0.0,-0.3939
It's not protected,0.546,0.454,0.0,-0.3412
Just use the Hide feature…,0.298,0.702,0.0,-0.1779
I just text them to myself,0.0,1.0,0.0,0.0
"If you spent $250k on a sports car you wouldn't leave it in the garage sitting because you were afraid you would scratch it or crash it.Maybe you wouldn't, but I assure you that's exactly what happens with $250k+ sportscars.",0.109,0.865,0.027,-0.5155
"Yeah that’s not the best analogy, a lot of high end cars don’t get used as much.",0.172,0.715,0.112,-0.2887
"Cars hold significantly more value, to the point if you are financing or leasing it is required to hold insurance (though that is more to the fact that cars can actually cause physical and bodily damage to others)",0.076,0.859,0.064,-0.1298
"Lol that’s exactly what I was thinking, that thing is for the garage the track and maybe an empty highway.",0.083,0.787,0.13,0.25
“he never drives it! He just rubs it with a diaper!”,0.0,1.0,0.0,0.0
That was my exact first thought. Guy clearly doesn’t know anyone with expensive sports cars. Haha.,0.0,0.711,0.289,0.6908
Touché!,0.0,1.0,0.0,0.0
I mean they would have the paintwork insured…,0.0,1.0,0.0,0.0
IT’S CALLED PATINA AND IT’S CLASSY.,0.0,0.633,0.367,0.4404
Oh those are those fancy toilets right? I think I’ve heard of them,0.0,1.0,0.0,0.0
"I don’t use either case nor screen protector and don’t give a flying f about scratches. It’s just an item that you use every day, why bother lol",0.085,0.816,0.099,0.1027
I use a case as my hands are super slippy and dry and im clumsy but i gave up on protectors. End of year early next im piffing this phone to my aunt so will replace screen and battery as she doesn't want a large gouge centre right.The xr will be 2 yrs old and has had more face down drops than any other phone and its solid. Hope the 13 is half as good as this phone has been,0.016,0.839,0.145,0.8938
Or get a glass screen protector?,0.0,1.0,0.0,0.0
There’s some great screen protectors for the iPhone 12 that you can’t even see once on. Add a thin/minimal case and you’re good to go.,0.0,0.759,0.241,0.7906
"I always use a screen protector and a thin clear case. My phones are usually still scratch-free after a couple of years, which helps the value when I trade them in for the latest gadget.",0.0,0.78,0.22,0.765
"Yep. I cracked my glass screen protector once, but my phone was fine.",0.0,0.725,0.275,0.4215
"That’s what I did after I noticed micro scratches.Can’t see them now!It’s cracked now, but I feel better because I know I can just peel it off and pop a new one on.",0.0,0.863,0.137,0.63
"Sure, get a screen protector and when you are ready to renew your iPhone, your screen is in perfect shape, now you can recycle your old but pristine iPhone.I don’t get the point.",0.0,0.835,0.165,0.5789
"Radio waves like bluetooth and wifi do not travel well through water, look up how submarines communicate to see how hard it is. Some communication from the watch must be making the phine pause when it is broken off (?)",0.141,0.803,0.056,-0.4242
"But the AirPlay is from the phone to the stereo. Neither is underwater. The watch, even in airplane mode, still stops the communication.Edit: yes, there seems to be an unnecessary dependency on the watch. No idea why or how to circumvent it.",0.099,0.825,0.075,-0.0387
Is it every time? Could it be “touching” the pause button?,0.0,1.0,0.0,0.0
"It’s every time. Even after I upgraded to the phone. Even if I enable the “water lock.” Music on, put hand under water, music stops.",0.062,0.814,0.124,0.3818
Does it happen if you walk away from your phone far enough to disconnect the Bluetooth?,0.0,1.0,0.0,0.0
"Do you have it set to show the audio controls by default when you raise to wake? If so, it could be that the water is pushing the play or pause button(s) and stopping the music. See if the same thing happens when you just cover the watch with multiple fingers.",0.03,0.925,0.045,0.2023
"I put the watch in water lock mode. Same result.What you describe happens in the shower, when the controls are activated and pause the music. What happens with submersion is an actual disruption in communication.",0.07,0.93,0.0,-0.3612
Water kills radio waves. Use something else that’s always above water.,0.259,0.741,0.0,-0.5423
"Right, but why does my phone require the watch to AirPlay to a stereo? The phone and stereo aren’t in the water. I’d think putting the watch in airplane mode would break any dependency the phone has on it.",0.0,1.0,0.0,0.0
Why the downvote? It’s a legit question,0.0,1.0,0.0,0.0
"Radio waves like bluetooth and wifi do not travel well through water, look up how submarines communicate to see how hard it is. Some communication from the watch must be making the phine pause when it is broken off (?)",0.141,0.803,0.056,-0.4242
"But the AirPlay is from the phone to the stereo. Neither is underwater. The watch, even in airplane mode, still stops the communication.Edit: yes, there seems to be an unnecessary dependency on the watch. No idea why or how to circumvent it.",0.099,0.825,0.075,-0.0387
Is it every time? Could it be “touching” the pause button?,0.0,1.0,0.0,0.0
"It’s every time. Even after I upgraded to the phone. Even if I enable the “water lock.” Music on, put hand under water, music stops.",0.062,0.814,0.124,0.3818
Does it happen if you walk away from your phone far enough to disconnect the Bluetooth?,0.0,1.0,0.0,0.0
"Get the “image” you want, Download Sticker.ly on the app store, Make those images in to stickers, Transfer to WhatsApp.",0.0,0.936,0.064,0.0772
"So i wanted to try and see if there was another way around this method, because then I have to do like 100 different stickers and if I change my bitmoji I need to redo them all",0.0,0.928,0.072,0.3612
Do you mean Memoji? Because those are sent as stickers only,0.0,1.0,0.0,0.0
Pretty sure he means bitmoji which is a Snapchat thing but originally made by Bitstrips,0.0,0.762,0.238,0.4118
"Get the “image” you want, Download Sticker.ly on the app store, Make those images in to stickers, Transfer to WhatsApp.",0.0,0.936,0.064,0.0772
Not possible have to do what @17jde said,0.0,1.0,0.0,0.0
"Get the “image” you want, Download Sticker.ly on the app store, Make those images in to stickers, Transfer to WhatsApp.",0.0,0.936,0.064,0.0772
"So i wanted to try and see if there was another way around this method, because then I have to do like 100 different stickers and if I change my bitmoji I need to redo them all",0.0,0.928,0.072,0.3612
Do you mean Memoji? Because those are sent as stickers only,0.0,1.0,0.0,0.0
Pretty sure he means bitmoji which is a Snapchat thing but originally made by Bitstrips,0.0,0.762,0.238,0.4118
There’s a lot in Amazon.,0.0,0.638,0.362,0.1779
Really? I have looked all over and the only keyboards that'd fit in a pocket are ones made out of rubber that you can roll up so not so good for actually typing and the only foldable ones I've been able to find only fold twice instead of three times so they don't actually fit in your pocket.,0.055,0.864,0.081,0.1635
"There are roll-up bluetooth keyboards. I have no idea if they're any good.Most of the flooding keyboards today don't have that extra fold in the middle that makes your's ""pocketable.""",0.073,0.927,0.0,-0.296
"A friend bought one of the roll up ones - they're terrible, almost unusable, but a clever gimmick at least.",0.094,0.644,0.262,0.5653
I found those keyboards to be garbage. But that’s my experience.,0.0,1.0,0.0,0.0
Back in the day I had a device that projected a keyboard onto the table and detected your finger position to act as a key press.,0.0,1.0,0.0,0.0
"I had one too… super cool looking, virtually impossible to type well on.",0.0,0.52,0.48,0.8074
"This one? Portable Bluetooth Keyboard, iClever BK03 Mini Foldable BT 5.1 Wireless Keyboard, Durable Aluminum Alloy Housing, for iOS Android, Windows, PC, Tablet, with Rechargable Li-ion Battery https://www.amazon.com/dp/B00YWLJNPQ/ref=cm_sw_r_cp_api_glt_fabc_NN539P1EK0C8Q5EVMSXK?_encoding=UTF8&psc=1",0.0,1.0,0.0,0.0
This one only folds twice so not pocketable. There's a third fold in the center of the keyboard which allows you to put it in a pocket and walk around the city without needing to carry a bag.,0.0,1.0,0.0,0.0
Best bet is to search Amazon for “stowaway keyboard” as that is what that one was called.  Here is one:  https://www.amazon.com/Targus-PA830U-Stowaway-Portable-Keyboard/dp/B00005LZNN/ref=sr_1_8?dchild=1&keywords=stowaway+keyboard&qid=1625075316&s=electronics&sr=1-8,0.0,0.763,0.237,0.7096
https://www.cnet.com/products/think-outside-stowaway-sierra-bluetooth-keyboard/No idea if it pairs with iOS. I assume it does since it was using a Bluetooth HID profile. Folds into three sections. Forgot how to pair mine since I haven’t used it since the Nokia Maemo OS days.,0.057,0.943,0.0,-0.2808
This is exactly what I'm looking for! Thank you. Bluetooth is backwards compatible so there is no reason the iphone with bluetooth 5.0 support shouldn't be able to connect to bluetooth 1.2. I had no idea this existed because most of the stowaway bluetooth keyboards only fold once.,0.092,0.805,0.103,0.1443
You just gave me flashbacks to the days of the Palm T|X 😭,0.0,1.0,0.0,0.0
"Not exactly the same, but would this work?",0.0,1.0,0.0,0.0
"Change your amazon search to “pocket keyboard Bluetooth”. I immediately saw at least a dozen that fold up to the size of a phone. They aren’t going to be full sized, but that’s unavoidable.",0.0,0.957,0.043,0.09
Literally any Bluetooth keyboard will workAlso why are you so keen on sticking a keyboard into your pantsFanny packs and backpacks exist.,0.0,0.861,0.139,0.5009
"While the iPad supports a Bluetooth mouse and keyboard, you'll have to jailbreak the iPhone to get that to work. https://keyboard.ringwald.ch/Welcome.html",0.0,0.884,0.116,0.3612
this,0.0,1.0,0.0,0.0
Welcome to 2021 😀have you tried voice dictation?,0.0,0.7,0.3,0.4588
Tell him bout the touch keyboard every iPhone has. And dont forget you can swipe over the Keyboard for easier and faster typing ;),0.0,0.767,0.233,0.656
I’m a journalist. I use an iPad with a Logitech keyboard to do this.There are Bluetooth keyboards that also work for iPhones,0.0,1.0,0.0,0.0
"Siri can now process many types of requests offline without an internet connection, including Timers & Alarms, Phone, Messaging, Sharing, App Launch, Control Audio Playback, and Settings. It’s needed an iPhone XR, XS, or newerSo what I’m hearing is it won’t take 30 seconds for Siri to call someone or send a text anymore?",0.065,0.884,0.051,0.0516
I hope so. Takes way to long some times until I am sure Siri got me and does what I told them.,0.0,0.766,0.234,0.6369
"“Hey Siri, resume music playback” “Uhm….” “One sec……. “ “Working on it……. “ (24 hours later)“Huh.. yeah.. sorry. Can’t do. Something’s wrong here.”",0.188,0.812,0.0,-0.5267
I thought this is the time where we can cancel if we call the wrong person,0.282,0.718,0.0,-0.6249
"I wonder why it can do messaging but not set reminders offline? That is usually what I use Siri for, shouldn’t need more than a simple offline text-to-speech, even if it’s not as accurate as the online one.",0.0,0.914,0.086,0.2755
Sounds like it won’t be compatible with my regular X for some Apple-esque reason 😞,0.0,0.828,0.172,0.3612
How is your Siri when your screen is off? I try to use it when I’m driving but never seems to trigger for me. I had similar issue with google assistant on my Samsung but not exactly sure what maybe the issue,0.059,0.941,0.0,-0.3491
I’m running beta. And Siri is very smooth and responsive.,0.0,0.765,0.235,0.4144
"That's my biggest gripe with Siri, namely because my cell service near my workplace is usually sufficient to send a message or make a phone call but it's not good enough to run Siri.So when I hop in the car and go to use Siri to try and call my spouse to let them know I'm on my way home, Siri just does that ""One sec... Working on that... Please try again later"" shit over and over.",0.098,0.866,0.036,-0.7235
The only time I ever used Siri was on Christmas 2012 when I got a 5th gen iPod touch for Christmas,0.0,1.0,0.0,0.0
The power of the Apple Neural Engine enables speech recognition models with the same high quality as server-based speech recognition.Oh.,0.0,1.0,0.0,0.0
the same low-to-the-ground quality you know and love!,0.0,0.609,0.391,0.6696
"Siri is like the worst thing ever. For the longest time I thought that there was something wrong with my devices everytime it screwed up the simplest things, but then I find out that everyone is facing the same issues. I won’t believe it until I see it",0.138,0.826,0.036,-0.6059
The only thing I use Siri for is setting timers,0.0,1.0,0.0,0.0
Is it worth getting?,0.0,0.612,0.388,0.2263
"I thought I’d share what I just found.Finally I can define a custom icon for the website I saved on my Home Screen instead of the useless screenshot it normally uses, that for some reason can’t be changed.Now I can book washing machines with a nice custom picture of a washing machine converted to a fish tank",0.051,0.806,0.143,0.6124
Very nice tip. Thanks for sharing!,0.0,0.243,0.757,0.8537
You could also use shortcuts app. It will be more easier by that way.,0.0,0.808,0.192,0.4754
"I tried that, but the only way to have to website show up without the address bar and bottom bar is to use safaris “Add to Home Screen” option.This JavaScript ‘javascript:var%20s=document.createElement('link');s.setAttribute('rel',%20'apple-touch-icon');s.setAttribute('href',prompt('Touch%20icon%20URL?','https://'));document.getElementsByTagName('head')%5B0%5D.appendChild(s);void(s);’Add any new bookmark, then go to your bookmarks and edit the one you just made, and paste in the JavaScript instead of the address.Then you just go to whatever page you want to Add to Home Screen, then fire up the bookmark you created, it’ll prompt you for a picture, I used one found on Imgur. Then you Add to Home Screen like normal, name it whatever you like, and instead of the ugly screenshot, you’ll have a beautiful icon. 😍",0.061,0.811,0.128,0.8047
Just turn off Badges for each app you don't want in Settings > Notifications,0.092,0.908,0.0,-0.0572
Set your notifications per app properly.,0.0,1.0,0.0,0.0
"Yes, the badges, I know what you mean and I agree. Like the TMobile Tuesdays, Novo Bank, FuelRewards, blah blah blah. Apps I need for various reasons that I never need to read their messages. I'd like to clear the messages / notifications from the app itself (tiny red number, badge). Which is not like clicking Clear All Notifications on the lock screen.",0.091,0.672,0.237,0.8811
"Did you mean the notification badge? Because if you’re talking about actual notifications, we’ve had Clear All Notifications for years, and notifications will be grouped by app automatically in the notification centre, then you can simply swipe to clear that group.",0.0,0.882,0.118,0.6369
Actually I’m referring to the red bubbles on the home screens. They can get out of hand and look annoying.,0.113,0.753,0.134,0.128
You’ll get the better offer from Verizon due to the 24 month payment.,0.0,0.805,0.195,0.4404
At&t is also doing the 700$ trade in. But they lock you in for 36 months I believe. If you’re not going to change Carriers it’s not a big deal and the time will go by quick. I’m not sure about upgradability either. It would better not to have phone payments if you don’t have to as your phone will be supported for a long time.,0.035,0.867,0.098,0.655
I have this exact problem amd I don’t want to be locked into any contract even though I have had VZW for over 10 years.I was told by customer service that you could pay off the phone in store after purchasing the phone online. I was considering doing that because $300 bucks (my costs) for a new phone isn’t bad…,0.071,0.906,0.023,-0.4215
"I just did it yesterday. I figure $700 for an almost 2 year old phone is a great deal. My monthly payment is $12.5 per month for the 12 Pro after the trade in, and I am able to upgrade in one year to the next model. The new phone arrives today.I’m not planning to leave Verizon and my family plan has me locked in to a solid unlimited employee plan from the early 2000s, so for me it was a good move.",0.0,0.881,0.119,0.8293
They usually do it in monthly credits so it won’t all be applied at the beginning. That’s how they still keep you locked in.,0.0,0.902,0.098,0.3612
"It’s a great offer but why are they giving you such a good offer now? The new iPhones are coming out in about 3 months so they’ll be trying to get rid of some existing inventory making loads of money getting people to upgrade just for them to find out there’s a new one in a couple of months!Keep your 11 Pro for now then sell it on eBay yourself and buy an iPhone 12S or 13 directly from Apple. $525 as a trade in from Apple is bad, you’ll easily be able to sell it on eBay for $700 maybe a little less once the new ones are released but if you buy a new one for $1,000, that’s $300 to upgrade after selling the old one. Don’t sign up to any monthly contracts locking you in for 2 years.",0.033,0.878,0.089,0.7988
you do know with his $700 trade in he only would owe $300 ish for the phone and can just leave his contract if he pays it off whenever he wants. he’s not locked in for 2 years lol. that 2 years is to pay off the phone if you don’t pay it off before the 2 years is up my dude.,0.065,0.89,0.045,0.2023
"A Verizon iPhone will lock you into Verizon, you can’t use that phone with any other carrier if you change",0.0,1.0,0.0,0.0
Verizon will unlock phone after payoff. I’ve paid off many Verizon devices.,0.0,1.0,0.0,0.0
Actually Verizon unlocks the phone after 60 days,0.0,1.0,0.0,0.0
"The apple renewal is expensive at least in the UK, it’s cheaper to do the renewal manually. The Verizon seems a decent deal, and you may get access to their fast network thing eventually",0.0,1.0,0.0,0.0
"It’s better getting unlocked, saves the hassle",0.0,0.674,0.326,0.4404
Keep the 11. Save some resources.,0.0,0.61,0.39,0.4939
How can you upgrade after a year with Verizon when doing their trade-in promo locks you in for 24 months via credits for the $700,0.0,0.902,0.098,0.3612
"Financially this is a bad decision. The 12 and arguably the 13 based on leaks is not a good enough upgrade overall to warrant the financial hit if you own your 11 pro outright and it has no issues.Had I not dropped and lost my 11 pro in the French Broad river on the 4th… I’d keep it until at least the 14 and then either sell it for market value or keep it as a spare.If you can, never be subservient to a lender, own your devices and only pay for service that you can drop at your discretion.",0.13,0.829,0.042,-0.8044
"If the owner put their information in contacts and selected that as “my information” in settings, you can ask Siri “whose phone is this?”Guess that’s not going to work if you reset it though.",0.0,1.0,0.0,0.0
"When I first charged the phone it said I needed internet connection to setup/use Siri.  I am normally an android user, so I'm not too familiar with the apple software.",0.065,0.935,0.0,-0.2023
If there's a SIM card inside you can use that to find out the service provider and then possibly have them look up the owner with the help of the IMEI.,0.0,0.915,0.085,0.4019
I called AT&T but was told they couldn't give me a customers contact info.,0.0,1.0,0.0,0.0
Did you try the emergency contact?,0.342,0.658,0.0,-0.3818
by chance was this in san marcos?,0.0,0.75,0.25,0.25
West Virginia,0.0,1.0,0.0,0.0
What iPhone? If an 11 or newer bring it near your home WiFi and maybe it will ping iCloud so you can find out?,0.0,1.0,0.0,0.0
Have you tried looking at their Medical ID?Pro tip: I do this with all of my devices as it allows easy contact access to who I am and my family members if the device is found with or without rebooted,0.0,0.927,0.073,0.4404
"Prior to resetting it you could have got contact info, but now it would be impossible. Also if the person who lost it had anything of sentimental value on it it’s worthless to them now. No point bothering at this point, I’m sure it’s long since been replaced.l given service was cut to it and likely routed to the replacement.",0.204,0.678,0.117,-0.7684
"Hey Siri, call mom.",0.0,1.0,0.0,0.0
Photogrammetry I believe,0.0,1.0,0.0,0.0
"Well that’s even cooler!!!I was referring to 2D images though - I believe it’s available to the public but can’t find it, as I’m not sure the terms to search.Thanks for that though - seriously cool tech!",0.112,0.747,0.141,0.2903
"Adobe Capture (you can capture shapes, fonts, textures, and images) is what I would use, or Adobe Lightroom if you needed to edit on the fly before dropping in to InDesign.",0.0,1.0,0.0,0.0
Bingo - thank you!,0.0,0.417,0.583,0.4199
"Wife has the Pro, I have the Pro Max.. I would say there is almost no difference in video quality, but there is a minor difference in how good the stabilization is for video. Pro Max has slightly better stabilization.The size of the Pro is better in my opinion. I went with the Max for better battery life and the supposed better cameras, but in the end the differences are very small and the size is a bit larger than I would like.",0.016,0.759,0.225,0.9652
"Thank you! So if you film a stable video with both phones side by side at night, there would be very little maybe unnoticeable difference?",0.0,0.815,0.185,0.6114
How big of a difference is there between the battery lifes of both phones?,0.0,1.0,0.0,0.0
"12 pro max I have ,perfect size for me and battery is excellent",0.0,0.575,0.425,0.8126
Get the 12 Pro it’s perfect for most that isn’t as huge as the Max. From what I’ve seen the cameras also perform quite similarly.,0.0,0.793,0.207,0.7184
