sentence,neg,neu,pos,compound
China tech giant Xiaomi aims at global smartphone top spot,0.0,0.833,0.167,0.2023
Xiaomi to invest $10bn in electric vehicle race,0.0,1.0,0.0,0.0
Google denies Xiaomi access over security bug,0.275,0.49,0.235,-0.1027
Xiaomi smartphone has 108 megapixel camera,0.0,1.0,0.0,0.0
Xiaomi: The Chinese brand dominating India's smartphone market,0.239,0.761,0.0,-0.296
Xiaomi's double-folding smartphone,0.0,1.0,0.0,0.0
Xiaomi's founder Lei Jun receives £735m bonus,0.0,0.632,0.368,0.5423
Xiaomi reveals fold-in-three smartphone,0.0,1.0,0.0,0.0
Xiaomi criticised for UK smartphone £1 flash sale,0.286,0.714,0.0,-0.4215
Xiaomi told to be clearer after £1 phone complaints,0.252,0.748,0.0,-0.4019
Xiaomi's trading debut in Hong Kong disappoints,0.302,0.698,0.0,-0.3818
Xiaomi's Poco F1 phone threatens a price war,0.565,0.435,0.0,-0.7579
"Chinese tech giant Xiaomi enters UK with phones, wristband and scooter",0.0,1.0,0.0,0.0
Xiaomi launches $10bn Hong Kong stock market listing,0.0,1.0,0.0,0.0
Facebook snaps up Xiaomi's Hugo Barra,0.0,1.0,0.0,0.0
Xiaomi buys Microsoft smartphone patents,0.0,1.0,0.0,0.0
Xiaomi chief says mobile phone firm grew too quickly,0.0,1.0,0.0,0.0
Xiaomi unveils huge 'pocket-sized' budget handset,0.0,0.685,0.315,0.3182
How to say: Xiaomi,0.0,1.0,0.0,0.0
Xiaomi Mi Drone poses price challenge to DJI,0.0,0.843,0.157,0.0772
Xiaomi launches cheap action camera,0.0,1.0,0.0,0.0
MWC 2016: Xiaomi unveils ceramic-backed Mi5 smartphone,0.0,1.0,0.0,0.0
Xiaomi: Has the 'Apple of the East' lost its shine?,0.204,0.796,0.0,-0.3182
Xiaomi 'overtakes' Samsung in China,0.0,1.0,0.0,0.0
Xiaomi: 'Others copy our best ideas',0.0,0.543,0.457,0.6369
Chinese smartphone maker Xiaomi plots global growth,0.0,0.698,0.302,0.3818
Xiaomi takes on smartphone rivals,0.0,1.0,0.0,0.0
"China's Xiaomi unveils two thinner, lighter phablets",0.0,1.0,0.0,0.0
Xiaomi: A beginner's guide to 'China's Apple',0.0,1.0,0.0,0.0
Can Xiaomi take a bite out of Apple?,0.0,1.0,0.0,0.0
Chinese tech firm Xiaomi's revenue doubles in 2014,0.0,1.0,0.0,0.0
China's Xiaomi becomes most valuable tech start-up,0.0,0.639,0.361,0.5256
Xiaomi: The biggest smartphone maker you've never heard of,0.0,1.0,0.0,0.0
Xiaomi phones to be sold in the US via a third-party,0.0,1.0,0.0,0.0
Xiaomi told to to stop selling phones in India,0.216,0.784,0.0,-0.296
Xiaomi to open online US store but not sell smartphones,0.0,1.0,0.0,0.0
Xiaomi unveils Mi 4 smartphone and Mi Band wristband,0.0,1.0,0.0,0.0
Xiaomi: Global plans for Chinese smartphone maker,0.0,1.0,0.0,0.0
Xiaomi to open India data centre to allay privacy fears,0.237,0.763,0.0,-0.4215
Google executive Hugo Barra poached by China's Xiaomi,0.0,1.0,0.0,0.0
